1,Advisory Committee on Novel Foods and Processes,Food Standards Agency,Advisory NDPB,-,0,No,Advises the FSA on any matters relating to novel foods (including genetically modified foods) and novel processes (including food irradiation).  For 'Public Meetings': one open workshop held each year,Established 1988.,"ACNFP Secretariat, Room 3B Aviation House, 125 Kingsway, London, WC2B 6NH
",020 7276 8596,acnfp@foodstandards.gsi.gov.uk,http://acnfp.food.gov.uk/,Professor Peter Gregory,£205 per day,Dr Sandy Lawrie,Civil Servant,Yes,Yes,Yes,PHSO,2007,2012,-,"£23,600",0,1,No
1,Advisory Committee on the Microbiological Safety of Food,Food Standards Agency,Advisory NDPB,-,0,No,"Provides expert advice to Government on questions relating to microbiological issues and food.
",Established 1990.,"ACMSF Secretariat, Room 3C Aviation House, 125 Kingsway, London, WC2B 6NH
",020 7276 8947,acmsf@foodstandards.gsi.gov.uk,http://acmsf.food.gov.uk/,Professor Sarah O'Brien,£205 per day,Ms Geraldine Hoad,Civil Servant,Yes,Yes,Yes,PHSO,2011-12,2011,-,"£22,000",0,3,No
1,"Committee on Toxicity of Chemicals in Food, Consumer Products and the Environment",Food Standards Agency,Advisory NDPB,-,0,No,"Advices the FSA, the DoH and other Government Departments and Agencies on matters concerning the toxicity of chemicals.
",Established 1978.,"COT Secretariat, Food Standards Agency, Room 3C Aviation House, 125 Kingsway, London, WC2B 6NH",020 7276 8522,cot@foodstandards.gsi.gov.uk,http://cot.food.gov.uk/,Professor David Coggon,£205 per day,Dr Diane Benford,Civil Servant,Yes,Yes,Yes,PHSO,2011,2012,-,"£26,100",0,3,No
1,General Advisory Committee on Science,Food Standards Agency,Advisory NDPB,-,0,No,"Provides independent advice on the FSA's governance and use of science.
",Established 2007.,"GACS Secretariat, Food Standards Agency, Room 1B Aviation House, 125 Kingsway, London, WC2B 6NH
",020 7276 8277,gacs@foodstandards.gsi.gov.uk,http://gacs.food.gov.uk/,Professor Colin Blakemore,£255 per day,Dr Patrick Miller,Civil Servant,Yes,Yes,Yes,PHSO,2011-12,2012,-,"£11,800",0,2,No
1,"Social Science Research Committee, The",Food Standards Agency,Advisory NDPB,-,0,No,"Provides advice to the FSA about how it gathers and uses social science evidence.
",Established 2008.,"SSRC Secretariat, Food Standards Agency, Room 1C Aviation House, 125 Kingsway, London, WC2B 6NH
",020 7276 8494,ssrc@foodstandards.gsi.gov.uk,http://ssrc.food.gov.uk/,Professor Peter Jackson,£255 per day,Dr Sian Thomas,Civil Servant,Yes,Yes,Yes,PHSO,2011-12,Triennial Review due 2012/13.,-,"£13,800",0,1,No
1,British Council,Foreign and Commonwealth Office,Executive NDPB,Retain,0,No,To create international opportunities for the people of the UK and other countries and build trust between them worldwide.,Established 1934.,"British Council Customer Services UK, Bridgewater House, 58 Whitworth Street, Manchester M1 6BB",0161 957 7755,general.enquiries@britishcouncil.org,www.britishcouncil.org,Sir Vernon Ellis,-,Martin Davidson,"£228,043",No,Yes,Yes,-,2011-12,2011,NAO,"£180,500,000","£720,400,000",6836,No
1,Foreign Compensation Commission,Foreign and Commonwealth Office,Tribunal NDPB,Retain,0,No,"The FCC is a tribunal established under the Foreign Compensation Act 1950 to assess the amount of compensation British claimants are entitled to under international and British law for losses suffered abroad. The FCC has also helped in the settlement negotiations of British property losses overseas at the hands of foreign Governments. Where compensation is secured through diplomatic or other means, the FCC determines the entitlement of claimants to compensation.","The Chair is appointed by the Lord Chancellor and paid by the FCO.  In the absence of any current compensation programme, the Commission is staffed part-time to deal with on-going queries from foreign governments and the public about previous claims.","SG130, Old Admiralty Building, London, SW1A 2PA",020 7008 1321,john.barker@fco.gov.uk,www.fco.gov.uk/en/publications-and-documents/publications1/annual-reports/foreign-compensation-commissio1/,John Barker,£468 per day - this is not a full time post - remunerated as and when required,-,-,No,No,No,PHSO,2009,1996,NAO,0,"£51,295",-,-
1,Great Britain China Centre,Foreign and Commonwealth Office,Executive NDPB,Retain,0,No,"To facilitate effective dialogue with the Chinese government, society and business to provide direct delivery of HMG policy objectives.  GBCC promotes mutual understanding between the UK and China and aims to build long-term connections between the decision-makers in the two countries.",Established 1974. Chief Executive at 03/2012 was Katie Lee,"15 Belgrave Square, London, SW1X 8PS",0207 235 6696,contact@gbcc.org.uk,www.gbcc.org.uk,Peter Batey,£0,Richard Pascoe,"£98,844",Yes,Yes,Yes,PHSO,2011-12,2010,NAO,"£270,000.00","£1,443,073",6,Yes
1,Marshall Aid Commemoration Commission,Foreign and Commonwealth Office,Executive NDPB,Retain,0,No,Set up by Marshall Aid Commission Act 1953 to oversee Marshall Scholarships; which are postgraduate Scholarships in the United Kingdom for American students with the potential to excel in their chosen fields of study and future careers.,Established 1953. ,"C/o ACU, Woburn Place, 22-24 Tavistock Square, London  WC1H 9HF",0207 380 6703,macc@acu.ac.uk,www.marshallscholarship.org,Dr E John Hughes,£0,Dr John Kirkland,£0,No,Yes,Yes,PHSO,2011,Triennial Review due 2012/13.,NAO,"£1,900,000","£1,914,863",0,Yes
1,"Westminster Foundation for Democracy, The",Foreign and Commonwealth Office,Executive NDPB,Retain,0,No,"WFD's work focuses on strengthening parliaments and political Parties in Africa, Asia, Eastern Europe and the Middle East.",Established 1992,"8th Floor Artillery House, 11/19 Artillery Row, London, SW1P 1RT
",020 7799 1311 ,tamara.moluch@wfd.org,www.wfd.org/,Gary Streeter MP,0,Ms Linda Duffield,"£97,000",No,No,Yes,PHSO,2012,2010,NAO,"£3,500,000","£5,784,811",17,Yes
9,Regional Advisory Committees (x 9),Forestry Commission,Advisory NDPB,-,9,No,"To advise the Forestry Commissioners on the performance of the Forestry Commissioners' functions under Section 1(3) and Part II of the Forestry Act 1967, and on such other functions as the Forestry Commissioners may from time to time determine.","The Committees are appointed by the Forestry Commissioners under Sections 37 and 38 of the Forestry Act 1967. Chairs and Members are normally appointed for a 3-year term of office, this may be renewed. *Reviewed as part of the Forest Regulatory Taskforce, Mar 2012.  Review will be closed after the government's response to the Independent Panel on Forestry has been published Jan 2013.","Forestry Commission, National Office for England, 620 Bristol Business Park, Coldharbour Lane, Bristol, BS16 1EJ",0117 906 6000,fcengland@forestry.gsi.gov.uk,www.forestry.gov.uk/england-rac,Multiple (9 - one per English region),"£2,545",-,-,No,Yes,-,PHSO,2011-12,2011/12*,-,0,0,0,No
1,Equality and Human Rights Commission,Government Equalities Office,Executive NDPB,Retain and substantially reform,0,Yes,To promote equality and tackle discrimination in relation to the characteristics protected under the Equality Act 2010; promote good relations between groups; and provide institutional support for human rights across Great Britain.,Established 2007.  Trevor Phillips' term as Chair ended in September 2012. Baroness O'Neill appointed Chair from November 2012.,"2nd Floor Arndale House, The Arndale Centre, Manchester M4 3AQ",0161 829 8100,chair@equalityhumanrights.com,www.equalityhumanrights.com ,Trevor Phillips,"£147,000",Mark Hammond,"£130,000",No,Yes,Yes,PHSO,2011-12,2010,NAO,"£42,732,000","£43,232,000",347,Yes
1,Office for Budget Responsibility,Her Majesty's Treasury,Advisory NDPB,-,0,No,"The Office for Budget Responsibility (OBR) provides independent and authoritative analysis of the UK’s public finances. The main duty of the OBR is to examine and report on the sustainability of the public finances. In carrying out this duty, the OBR has four main responsibilities: the production of the fiscal and economic forecasts, including independent scrutiny of the impact of policy measures; an assessment of whether the Government’s fiscal mandate is being met; an assessment on the accuracy of the previous fiscal and economic forecasts; and an analysis of the sustainability of the public finances.",Established 2010.,"Office for Budget Responsibility, 20 Victoria Street, London,  SW1H 0NF",020 7271 2520,obrenquiries@obr.gsi.gov.uk,http://budgetresponsibility.independent.gov.uk/,Robert Chote,"£141,000",-,-,No,Yes,Yes,-,2011-12,-,NAO,"£1,750,000",0,17,No
1,"Royal Mint Advisory Committee on the design of coins, medals, seals and decorations",Her Majesty's Treasury,Advisory NDPB,-,0,No,"The purpose of the committee is to raise the standard of numismatic and medallic art in Britain and this remains its primary concern, being charged on behalf of HM Treasury and other government departments with the recommendation of all new designs for United Kingdom coins, official medals, seals and decorations.  It was established with the personal approval of King George V.","Established 1922.  The Royal Mint Advisory Committee’s Annual report 2011-12,  may be found within the Royal Mint’s Annual Report and Accounts for the same period.","The Royal Mint Museum, Llantrisant, Pontyclun, CF72 8YT",01443 623005,kevin.clancy@royalmintmuseum.org.uk,www.royalmintmuseum.org.uk/about-us/royal-mint-advisory-committee/index.html,Lord Waldegrave of North Hill,£0,Dr Kevin Clancy,£0,No,No,Yes,-,2011-12,Triennial Review 2011/12.,-,0,0,0,Yes
1,Advisory Council on the Misuse of Drugs,Home Office,Advisory NDPB,Retain,No,No,"Advisory, statutory, NDPB as constituted under the Misuse of Drugs Act 1971. ",Government funding includes funding for shared secretariats.,"Home Office, 2 Marsham Street, London, SW1P 4DF",020 7035 0555,rachel.fowler1@homeoffice.gsi.gov.uk,www.homeoffice.gov.uk/agencies-public-bodies/acmd/,Professor Les Iversen,£0,-,£0,Yes ,Yes,Yes,-,2010-11,2010,NAO,"£167,000",Subsumed into departmental budgets,0,Yes
1,Animal Procedures Committee,Home Office,Advisory NDPB,Retain,No,No,To advise the Secretary of State for the Home Office and Northern Irelands Office on their duties under the terms of the Animals (Scientific Procedures) act 1986.,Established 1987.  The committee will be dissolved on 31 December 2012 and be replaced by a new National Committee for the Protection of Animals used for Scientific Purposes as per EU Directive 2010/63.,"3rd Floor, Seacole Bldg, 2 Marsham Street, London SW1P 4DF.  ",020 7035 3053,apc.secretariat@homeoffice.gsi.gov.uk,www.homeoffice.gov.uk/agencies-public-bodies/apc/,Ms Sara Nathan,£237 per day - this is not a full time post - remunerated as and when required,-,-,No,Yes,Yes,PHSO,2009-10,2009,NAO,"£27,000",0,0,Yes
1,Independent Police Complaints Commission,Home Office,Executive NDPB,Retain,0,No,The IPCC has a dual purpose to act as an overall guardian ensuring the effectiveness and efficiency of the operation of the whole police complaints system and to also take a role in individual cases.,Established 2004. IPCC staff  are subject to the IPCC (Staff Conduct)Regulations 2004. Commissioners are subject to the terms of paragraphs 1&2 of Schedule 2 of the Police Reform Act 2002. A complaints procedure for complaints against Commissioners is in place. The Chair took up post on 1 April 2012.,"90 High Holborn, London WC1V 6BH",08453 002 002,enquiries@ipcc.gsi.gov.uk,www.ipcc.gov.uk,Dame Anne Owers,"£60,000",Jane Furniss,"£130,000-£135,000",Yes,Yes,Yes,-,2011-12,2010,NAO,"£33,200,000","£34,200,000",384,Yes
1,Independent Safeguarding Authority,Home Office,Executive NDPB,Merge,0,No,The role of the ISA is to help prevent unsuitable people from working with vulnerable groups including children.,Established 2008. In 2010 the ISA was reviewed and a decision made to merge the ISA and Criminal Records Bureau to create the Disclosure and Barring Service. Subsequently changes were made to the Protection of Freedoms Bill. The DBS became effective on 1 December 2012.,"Stephenson House, Alderman Best Way, Morton palms Business Park, Darlington, Co Durham, DL1 4WB",01325 953731,karen.leech@isa.gsi.gov.uk,www.isa.homeoffice.gov.uk,Sir Roger Singleton,"£81,200",Adrian McAllister,"£122,647",No,No,Yes,PHSO,2012,2010,NAO,"£15,800,000","£13,140,000",255,Yes
1,Investigatory Powers Tribunal,Home Office,Tribunal NDPB,Retain,0,No,To consider proceedings bought under  Section 7 of the Human Rights Act 1998 (HRA) against the intelligence services and certain public authorities in respect of their investigatory powers and conduct. To investigate complaints regarding actions by those intelligence services and public authorities who hold powers under the Regulation of Investigatory Powers Act to ascertain whether they have used those powers lawfully.  ,"The IPT was established by virtue of Section 65 of RIPA. The Tribunal assumed the jurisdictions previously held by Interception of Communications Tribunal, the Security Service Tribunal, the Intelligence Services Tribunal and the complaints function of the Commissioner appointed under the Police Act 1997. The President is paid expenses only. Departmental sponsorship costs are not separately identifiable in Home Office Accounts ","PO BOX 33220, London SW1H 9QZ",020 7035 3711,info@ipt-uk.com,www.ipt-uk.com,Lord Justice Mummery,-,-,-,-,-,-,-,2011 (statistical summary 2012),Triennial Review due 2012/13.,-,-,-,4,No
1,Migration Advisory Committee,Home Office,Advisory NDPB,Retain,0,No,"Provides independent, evidence based advice to government on migration, particularly shortages in the labour market where migration can contribute.",The MAC met for the first time on 7 December 2007,"Migration Advisory Committee, 2nd Floor, Fry Building, Home Office, 2 Marsham Sreet, London, SW1P 4DF",020 7035 1764 ,mac@homeoffice.gsi.gov.uk,www.ukba.homeoffice.gov.uk/aboutus/workingwithus/indbodies/mac/,Professor David Metcalf CBE,"£41,861",Tim Harrison,Civil Servant,No,Yes,No,-,-,Triennial Review 2011/12.,0,"£796,000",0,11,Yes
1,National DNA Database Ethics Group,Home Office,Advisory NDPB,Retain,No,No,To provide independent advice on ethical issues around the operations of the National DNA Database Ethics Group.,-,"3rd Floor Seacole Building, 2 Marsham Street, London, SW1P 4DF ",2070353049,kenny.chigbo@homeoffice.gsi.gov.uk,www.homeoffice.gov.uk/agencies-public-bodies/fsr/ndnad-ethics-group/,Christopher Hughes,No,N/A,N/A,No,Yes,N/A,-,2011,N/A,N/A,"£25,000",0,0,Yes
1,National Policing Improvement Agency,Home Office,Executive NDPB,No longer an NDPB,0,No,To support forces to deliver the best possible policing services to the public.,Established by the Police & Justice Act 2006.  The NPIA will close on 31 December 2012 and will be abolished by the Crime and Courts Bill.  ,"First Floor, Fry Building , 2 Marsham Street , London, SW1P 4DF",020 7147 8200,information.desk@npia.pnn.police.uk ,www.npia.police.uk,Peter Holland,"£80,000-£125,000",Nick Gargan ,"£155,000-£160,000",No,Yes,Yes,PHSO,2012,-,NAO,"£352,000,000","£389,900,000",1619,Yes
1,Office of Surveillance Commissioners,Home Office,Tribunal NDPB,Retain,0,Yes,"To keep under review public authority use of covert techniques under the Regulation of Investigatory Powers Act,  the Regulation of Investigatory Powers (Scotland) Act and the Police Act.",-,"PO Box 29105, London, SW1V 1ZU",020 7035 0074,oscmailbox@osc.gsi.gov.uk,http://surveillancecommissioners.independent.gov.uk/,Sir Christopher Rose (Chief Surveillance Commissioner ),"£140,000",-,-,No,No,No,-,2011-12,Triennial Review due 2012/13.,NAO,"£1,587,000","£1,392,601",23,No
1,Office of the Immigration Services Commissioner,Home Office,Executive NDPB,Retain,0,Yes,To regulate those who provide immigration advice and services by promoting good practice and investigating complaints,"Established May 2000.  There is no Board, the Commissioner is a corporation sole",Counting House 5th Floor 53 Tooley Street London SE1 2QN,020 7211 1500,enquiries@oisc.gov.uk,www.oisc.gov.uk,Suzanne McCarthy,"£88,760",Ian Leigh,"£60,234",No,No,Yes,PHSO,2011-12,2011,NAO,"£3,680,800","£3,991,870",59,Yes
2,Police Advisory Board and Police Negotiating Board (2 bodies),Home Office,Advisory NDPB,Under consideration,2,No,Negotiates and arbitrates on matters relating to police pay and conditions; provides advice to the Home Secretary on matters related to policing,-,"Office of Manpower Economics, 6th Floor, Victoria House, Southampton Row, London, WC1B 4AD",020 7271 0472,william.blase@bis.gsi.gov.uk,www.ome.uk.com ,Multiple,Multiple,-,-,No,No,No,-,2012,2012,-,"For 2012/13, the PNB is given £475204 funding which is split amongst the Staff, Official and Independent sides. The Police Arbitration Tribunal panel are paid a daily fee of £468 (chair) and £334 (member).","For 2011/12, the total expenditure for these bodies was £482797.27= £469954.81 for the PNB and £12842.46 for the PAT.",0,No
1,Police Arbitration Tribunal,Home Office,Tribunal NDPB,-,0,No,-,Combined with Police Advisory Board and Police Negotiating Board; details as for the same.,-,-,-,-,-,-,-,-,-,-,-,-,-,-,-,-,-,-,-
1,Police Discipline Appeals Tribunal,Home Office,Tribunal NDPB,Retain,0,No,"To consider appeals by police officers who have been found guilty of breaching the Code of Conduct, resulting in their dismissal, requirement to resign or reduction in rank.","Originally created when the Metropolitan Police was created in 1929. The current organisation is based on the Police Act 1996, Schedule 6 (as amended) and the 1985 Police Regulations.","Police Appeal Tribunal, Police Transparency Unit, 6th Flr, Fry Building, 2 Marsham Street, London, SW1P 4DF",020 7035 3108,sammy.jegede@homeoffice.gsi.gov.uk,-,Appointed as convened,-,Appointed as convened,-,No,No,No,-,-,-,-,£0,£0,0,No
1,Security Industry Authority,Home Office,Executive NDPB,No longer an NDPB,0,Yes,"The Security Industry Authority is the organisation responsible for regulating the private security industry. They are an independent body reporting to the Home Secretary, under the terms of the Private Security Industry Act 2001. ",The SIA was founded in 2003.,"90 High Holborn, London, WC1V 6WY",020 7025 4250,cassie.howe@sia.gsi.gov.uk,http://sia.homeoffice.gov.uk/Pages/home.aspx,Ruth Henig,"£65,956",Bill Butler,"£123,020",No,Yes,Yes,PHSO,2012,2010,NAO,"£200,000","£28,348,000",195,Yes
1,Serious Organised Crime Agency,Home Office,Executive NDPB,Merge,0,No,"To prevent and detect serious organised crime, to contribute to its reduction in other ways and the mitigation of its consequences and to gather, store, analyse and disseminate information on crime. ",-,"PO Box 8000, London, SE11 5EN",0370 496 7622,-,www.soca.gov.uk,Sir Ian Andrews,"£65,000-70,000",Trevor Pearce,"£145,000-150,000",No,No,yes,PSHO (Administrative functions only),2011-12,2010,NAO,"£447,900,000","£442,200,000",3652,Yes
1,Technical Advisory Board,Home Office,Advisory NDPB,Retain,0,No,To advise the Home Secretary on whether obligations imposed on communications service providers (CSPs) under the terms of the Regulation of Investigatory Powers Act 2000 (RIPA) are reasonable,Established 2002.,"The Technical Advisory Board, PO Box 38542, London SW1H 9YE",-,TAB@homeoffice.x.gsi.gov.uk,www.homeoffice.gov.uk/agencies-public-bodies/tab,Peter Walker,£400 per day,R Foss,Civil Servant,No,No,No,-,2011,Triennial Review 2011/12., - ,0, - ,0,Yes
1,Advisory Committee on Conscientious Objectors,Ministry of Defence,Advisory NDPB,Retain,0,No,The Committee is responsible for advising the Secretary of State for Defence on all claims to conscientious objection to further service in the Armed Forces made by officers and other ranks of the Armed Forces whose application for permission to retire or resign their commissions or for discharge have been refused by the Service authorities.,Established 1970.  When this body meets if the judge is salaried no fee is payable.,"06.F.12, MOD Main Building, Whitehall, London, SW1A 2HB",020 7218 0564,CLS-Sec1@mod.uk,-,His Honour Judge King,-,-,Civil Servant,Yes,Yes,No,-,2010,Triennial Review due 2012/13.,-,£0,£0,0,Yes
1,Advisory Group on Military Medicine,Ministry of Defence,Advisory NDPB,Retain,0,No,AGOMM is established to provide independent advice to the Secretary of State for Defence on medical issues relating to Medical Force Protection and Clinical Treatments used on operations.,Established as the Advisory Group on Medical Countermeasures in 1998.,"HQ Surgeon General, Floor 6 Zone E, MOD Main Building, Whitehall, SW1A 2HB",020 7218 9447,peter.crass192@mod.uk,-,Professor Blain,£465 per day,Sqn Ldr Pete Crass,Military Officer,No,No,Yes,PHSO,2011,Triennial Review due 2012/13.,-,£0,£0,0,Yes
1,Armed Forces Pay Review Body,Ministry of Defence,Advisory NDPB,Retain,0,No,"The Armed Forces' Pay Review Body is to provide independent advice to the Prime Minister and the Secretary of State for Defence on the remuneration and charges for members of the Naval, Military and Air Forces of the Crown.",Established 1971.,"6th Floor, Victoria House, Southampton Row, London, WC1B 4AD",020 7271 0469,gary.earle@bis.gsi.gov.uk,www.ome.uk.com/example/Armed_Forces_Pay_Review_Body.aspx,Professor Alasdair Smith,£350 per day respectively,-,-,No,No,Yes,-,2011-12,2007,-,£0,£0,0,Yes
1,Central Advisory Committee on Pensions and Compensation,Ministry of Defence,Advisory NDPB,Retain,0,No,The CAC acts as a policy advisory and consultative body for all service pension and compensation issues.,Established 1921.,"Central Advisory Committee on Pensions and Compensation, MOD Main Building, Level 6, Zone M, Desk 18, Whitehall, London SW1A 2HB ",020 7218 9681,PersTrg-Rem-AFCPol4@mod.uk,www.mod.uk/DefenceInternet/AboutDefence/WhatWeDo/Personnel/Pensions/TheCentralAdvisoryCommitteeOnPensionsAndCompensation.htm,"Minister of State for Defence Personnel, Welfare and Veterans",£0,Philip Gould,Civil Servant,No,Yes,Yes,PHSO,-,Triennial Review 2011/12.,-,£0,£0,0,Yes
1,Defence Nuclear Safety Committee,Ministry of Defence,Advisory NDPB,Retain,0,No,"The Defence Nuclear Safety Committee is responsible for providing the Secretary of State for Defence with an independent source of expertise and advice concerning the safety of Ministry of Defence nuclear programmes, facilities and operations.",Established 1999.,"1 L.10, MOD Main Building, Whitehall, London, SW1A 2HB",020 7218 7310,dst-strattechNWTSCF@mod.uk,-,Rear Admiral (Ret'd) P Thomas,£315 per day ,-,-,No ,No,No,PHSO,2011,2010,-,£0,£0,0,Yes
1,Defence Scientific Advisory Council,Ministry of Defence,Advisory NDPB,Retain,0,No,"DSAC is established to provide independent advice to the Secretary of State for Defence on all matters of concern to the Department in the fields of non-nuclear science, engineering, technology and analysis. ",Established 1969.,"1st Floor, Zone M, MOD Main Building, Whitehall, London SW1A 2HB",020 7218 7996,DST-StrategyAD@mod.uk,www.mod.uk/DefenceInternet/AboutDefence/WhatWeDo/ScienceandTechnology/DSAC/,Professor Ian Poll,£465 per day,Civil Servant,£0,No,No,No,PHSO,2011-12,2010/11,-,£0,£0,0,Yes
1,Independent Monitoring Board for the Military Corrective Training Centre,Ministry of Defence,Other NDPB,Retain,0,No,"The Independent Monitoring Board inspect the Military Corrective Training Centre at least twice a year and reports its findings to Ministers. It inspects, amongst other things, the condition of the premises and the treatment, health and welfare of detainees. The arrangements are very similar to those in place for civilian detention facilities in the UK.",Established 1979,"MCTC, Berechurch Hall Road, Colchester, ESSEX, CO2 9NU. ",07974 692473,-,www.army.mod.uk/agc/provost/2258.aspx,Andy Schooler,£0,-,-,No,No,MCTC Only,-,2011,2010,-,£0,"£1,178",0,No
1,National Army Museum,Ministry of Defence,Executive NDPB,Retain,0,No,"To gather, maintain and make known the story of the British Army and its role and impact in world history. To provide a museum experience that meets the widest range of public need and connects the British public with its Army.",Established 1960.,"Royal Hospital Road, London,  SW3 4HT",020 7730 0717,INFO@NAM.AC.UK,www.nam.ac.uk,General Sir Jack Deverell KCB OBE,£0,Mrs Janice Murray,"95,000",No,Yes,Yes,PHSO,2011-12,2009,NAO,"£5,753,900","£6,821,834",57,No
1,National Employer Advisory Board,Ministry of Defence,Advisory NDPB,Retain,0,No,"NEAB exists to provide informed but independent strategic advice to the Secretary of State for Defence and the MOD about how the MOD can most effectively gain and maintain the support of the employers of Britain's Reserve Forces.  The Board shall not exceed 15 members, and include representatives from the CBI, the TUC, the Institute of Directors and the British Chambers of Commerce. The Board should provide wide geographical coverage of the UK and a broad representation between manufacturing and service industries, large and small companies and public sector.",Established 2002 (NEAB is the successor to the National Employers' Liaison Committee).,"The National Employers Advisory Board, Floor 6, Zone D, MOD Main Building, Whitehall, London, SW1A 2HB.",020 7807 0326,charlie.anderson652@mod.uk,-,Mr R Boggis-Rolfe,£0,Secretariat support provided by MOD,Military Officer,No,No,No,PHSO,2009,Triennial Review due 2012/13.,-,£0,£0,0,Yes
1,National Museum of the Royal Navy,Ministry of Defence,Executive NDPB,Retain,0,No,"The goal of the Museum is to promote public understanding of the Royal Navy and its constituent branches, past, present and future",Established 2008.,"HM Naval Base, (PP66) Portsmouth, PO1 3NH",02392 727562,graham.dobbin@nmrn.org.uk,www.nmrn.org.uk,Admiral Sir Jonathon Band GCB,£0,Professor Dominic Tweddle,"£95,000",No,On request,Yes,PHSO,2011-12,2010/11,NAO,"£3,248,678","£6,210,557",25,No
