ignore-status,old_url,title,summary,body,type,policy_1,policy_2,minister_1,location,organisation,delivered_date,ignoretextdate
new,http://www.dft.gov.uk/news/statements/mcloughlin-20121015b,West Coast Main Line,"Oral statement by the Rt Hon Patrick McLoughlin MP, Secretary of State for Transport.","Mr Speaker, with permission I would like to make a statement on the West Coast Main Line.

On Wednesday 3rd October I announced the cancellation of the InterCity West Coast franchise procurement.

This decision was taken as the result of significant flaws found within the procurement process undertaken by my Department.

These made the continuation of the competition and the award of the franchise untenable.

I know how important the West Coast Main Line is to the economy of this country and to the constituents of Members.

This franchise operates over 300 train services a day, carries over 26 million passengers a year and employs more than 3000 staff.

Mr Speaker, this is a regrettable outcome caused by unacceptable mistakes made by officials in my Department during a complex procurement process.

It has also meant that I have paused the ongoing franchising programme, including live competitions on Essex Thameside, Great Western, and Thameslink.

I would like to reiterate that there is no suggestion that First Group or any of the other bidders including Virgin Trains acted in anything other than good faith during the bidding process.

First Group is a great British company and a leading transport operator both here and in the United States.

It provides jobs for 13,000 people across the UK and operates four railway franchises, which together carry over 300 million passengers a year.

I want to make it clear today that the cancellation of the West Coast competition should not be seen as a comment on FirstGroup, its bid, or its approach to running rail franchises now or in the future.

Furthermore, as I have said to the Transport Select Committee, Virgin has also made a fantastic contribution to both the railways and aviation in this country.

It would be premature at this stage to speculate on where and how the errors in the process emerged.

That is why, when I announced the cancellation of the procurement, I also asked for two urgent investigations to be carried out.

Both reviews are now well underway.

The first of these is an inquiry led by Sam Laidlaw, the Chief Executive of Centrica. He is the lead non-executive director on procurement across Government and the lead non-executive director of the Departmental board. 

His review is examining what happened during the West Coast procurement and why. It will establish the lessons to be learned.

I have asked for the initial findings of the review by the end of October and expect the full report by the end of November.

The second review is looking at the implications of the flaws on the West Coast procurement for the rest of the franchising programme.

This review is being led by Richard Brown, a highly-respected industry figure and the Chairman of Eurostar.

My expectation is that the Brown review will report no later than the end of the year on lessons for the future franchising programme - so that it can be resumed as soon as possible.

Mr Speaker, I am today publishing the terms of reference for both reviews, and these have already been laid in the Library of the House.

Before these reviews have been completed, and particularly before the findings of the Laidlaw review have been published, any speculation as to the nature of the flaws is just that - speculation.

I will of course report to the House on the findings of these reviews at the earliest opportunity.

However, I would like to take this opportunity to restate the Government's commitment to ensuring that we continue to have private sector innovation and investment in the railways.

Since privatisation, the number of passenger miles travelled has nearly doubled.

This growth brings significant benefits to the country's economy and to the environment, relieving congestion, improving connectivity for businesses, commuters and leisure travellers.

Passenger satisfaction is up. So is punctuality.

I want to see these benefits continue. That is why I want this pause while the reviews are carried out to be as short as possible.

We will restart our refranchising programme - including the competitions on Essex Thameside, Great Western, and Thameslink as soon as possible.

Mr Speaker, I would now like to turn to the future operation of the West Coast Main Line.

I am committed to ensuring that passengers will see no impact as a result of these mistakes.

Passengers will be able to make the journeys they have planned, with the tickets they have bought.

Clearly we will need to learn lessons from the two reviews. And we will need to run a new competition for the West Coast franchise.

I want this to happen as quickly as possible, but we want to get it right which will take time.

It is also important that in the intervening period we secure a deal which secures best value for the taxpayer, including, continuing improvement in service quality.

For this reason, I am today announcing that we are commencing negotiations with Virgin Rail Group with a view to them remaining as operator of passenger services for the West Coast Main Line.

Subject to ensuring value for money for the taxpayer, I expect this to last for a short period of around 9 to 13 months.

In this period we will run a competition for an interim agreement. This interim agreement, which would be open to any bidders, will then run until the new long-term West Coast franchise is ready to commence.

I will keep this approach under review so it can be informed by Richard Brown's findings and recommendations, and so it ensures value for money.

Mr Speaker, I am grateful to the team at Directly Operated Railways for all their preparation so far. Directly Operated Railways will continue to stand ready should they be required.

Britain's railways are a great success and I am determined that this incident does not get in the way of this Government's real record.

We have launched the biggest programme of investment since the Victorian era. We have also just announced reductions in regulated fares rises over the next two years, recognising the importance of access to the railways for millions of commuters.

And we are pressing ahead with the most ambitious and visionary infrastructure agenda in recent years - most notably in pursuing the transformative programme for High Speed 2.

I commend this statement to the House.

## Related documents

  * [West Coast Main Line written statement by the Secretary of State for Transport, 15 October 2012](http://www.dft.gov.uk/news/statements/mcloughlin-20121015a/)
  * [Department for Transport to negotiate with Virgin on temporary operation of West Coast rail services, press release 15 October 2012](http://www.dft.gov.uk/news/press-releases/press-dft-20121015a)
  * [Letter from the Secretary of State to Richard Brown regarding the InterCity West Coast franchise decision, 15 October 2012](http://www.dft.gov.uk/publications/richard-brown-20121015a/)
  * [Letter from the Secretary of State to Sam Laidlaw regarding the InterCity West Coast franchise decision, 15 October 2012](http://www.dft.gov.uk/publications/sam-laidlaw-20121015b/)",oral-statement,managing-improving-and-investing-in-the-road-network,,patrick-mcloughlin,,department-for-transport,15-Oct-2012,2012-10-15
new,http://www.dft.gov.uk/news/statements/mcloughlin-20121025a,High Speed Two - Assistance and compensation for home owners and occupiers on the London - West Midlands Route,"Written statement by the Rt Hon Patrick McLoughlin MP, Secretary of State for Transport.","In January the government announced that we would proceed with plans to build a high speed rail network linking London with Birmingham, Leeds and Manchester. High Speed Two (HS2) will have a transformative effect on Britain, bringing cities closer together and providing the new transport capacity we need to meet the challenges of the 21st century.

We need to drive forward with this vital national project. In doing so we need to provide support for those facing the disruption that the plans for the railway are causing, while also protecting the interests of tax-payers who will ultimately pay for compensation. We have been clear throughout that we are committed to providing appropriate compensation and assistance for those affected by the building of HS2.

The statutory system of compensation already provides fair compensation for the vast majority of infrastructure schemes. However, given the particular circumstances of HS2, in this case I believe it is right to go above and beyond what is required by law. Today I am launching a generous proposed compensation and support package for public consultation.

Under the proposals set out today all those living closest to the route of HS2, in the so-called 'safeguarded area', will be able to choose to sell their home to the government - whether it is required for construction or not - at any time after the HS2 route is safeguarded, which is currently expected to happen in Spring 2013. Those choosing to sell their homes will receive its full un-blighted value (that is, what the property would have been worth had there been no plans for HS2), a home loss payment of 10% of the value of the property (up to a maximum of £47,000) and be reimbursed for reasonable moving costs, including stamp duty on the purchase of a new property of equivalent value.

In rural areas we will establish a 'voluntary purchase zone', extending out from the boundary of the safeguarded area up to 120m either side of the line, within which homeowners will have the option to sell their homes to the government at their full unblighted value at any time after the HS2 route is safeguarded.

For those living beyond both the safeguarded area and voluntary purchase zone but who need to move house during the development of HS2 and find they are unable to sell their property, there will also be a 'long term hardship scheme' under which the government will buy the homes of successful applicants at their full unblighted value.

In addition, under the new 'sale and rent' back scheme, homeowners whose property will need to be acquired will have the option to sell their homes to the government early and stay in them as tenants until the properties are required for the railway.

We recognise that the owners of properties above tunnels may also be concerned about the potential impact of HS2 and therefore we are bringing in a series of measures designed to provide confidence in these properties.

Finally, we will work with local authorities, housing associations and affected tenants to agree a joint strategy to replace any social housing which is lost.

I must stress that we have already written directly to all those whose homes we currently expect to need to buy in order to build and operate HS2 on the London - West Midlands route. The wide-ranging proposals set out today reflect the significant nature of the concern that currently exists in the property markets near the HS2 line of route, they are not a reflection of what the government believes the long term impacts of HS2 will be. We fully expect that the impacts of HS2 will be considerably less than feared and that property prices will recover over time. However, we recognise that the current property markets near the HS2 line of route may not reflect this.

HS2 will be the backbone of a new transport system for the 21st century, offering the new railway capacity that our country will need to compete and grow. However, we fully recognise that the line will have unwelcome impacts on people living close to the route and I believe that this package of compensation demonstrates the strength of the government's commitment to provide the right compensation and assistance to those affected.

Alongside the property consultation published today, we are also publishing a consultation on safeguarding directions for HS2. This will set out the proposed area of land considered necessary to protect the line of route from conflicting developments, that is to say planning permission being granted for developments on land that will be required for the construction or operation of HS2. This will also set the 'safeguarded area' within which compensation measures will apply.

Both consultations will close on 31st January 2013.

## Related documents

  * [High Speed Two: Property and Compensation for London - West Midlands video](http://www.dft.gov.uk/publications/hs2-property-compensation-london-west-midlands)
  * [Government unveils generous HS2 compensation package](http://www.dft.gov.uk/news/press-releases/dft-press-20121025a/)",written-statement,developing-a-new-high-speed-rail-network,,patrick-mcloughlin,,department-for-transport,25-Oct-2012,2012-10-25
new,http://www.dft.gov.uk/news/statements/mcloughlin-20121025b,EU Transport Council 29 October 2012,"Written statement by the Rt Hon Patrick McLoughlin MP, Secretary of State for Transport.","I will attend the first Transport Council of the Cypriot Presidency (the Presidency) in Luxembourg on Monday 29 October.

The Presidency hopes to achieve General Approach on three proposals:

  * The first is a proposal for a Regulation of the European Parliament and of the Council on common rules for the allocation of slots, repealing Council Directive 95/93/EC. The proposed regulation has been subject to intense official-level scrutiny by Council Working Groups and these discussions are ongoing. Progress to date has been mixed, but the proposition remains acceptable from a UK perspective. I believe that the resulting regulation could help promote the most effective use of airport slots and build on the existing transparent, market-based approach to encourage the more efficient use of scarce capacity at congested airports, while minimising administrative and financial burdens for industry. However, at this stage, it remains unclear whether or not it will be possible to seek a General Approach at the October Council.
  * The second is a proposal for a Directive of the European Parliament and of the Council on the enforcement of certain provisions of the Maritime Labour Convention by flag States. The proposed General Approach represents a satisfactory outcome for the UK and I will support it as it allows appropriate flexibility to Member States, and will not require the UK to make any substantive changes to its proposed implementation of the provisions of the Maritime Labour Convention on flag State responsibilities.
  * The third is a proposal for a Directive of the European Parliament and of the Council amending Directive 2009/16/EC on port State control. I will support the proposal which will not require the UK to make any substantive changes to its proposed implementation of the provisions of the Maritime Labour Convention on port State responsibilities.

An orientation debate will be held on a proposal for a Directive of the European Parliament and of the Council on roadworthiness testing for motor vehicles and their trailers (First Reading). The UK strongly supports the ongoing roadworthiness testing of vehicles as a worthwhile contribution to road safety.

However, the UK is very concerned by the potential cost burden of the European Commission's proposal as it is currently framed. The UK alone has identified costs of over €1 billion without any discernable benefit in road safety. We have also identified significant administrative burdens embedded in the proposal that similarly would produce no road safety benefit. In the current economic climate the UK does not wish to see any additional cost to European citizens, businesses or governments unless clearly justified by road safety benefits.

The Presidency will be seeking a Political Agreement on the proposal for a Regulation of the European Parliament and of the Council amending Council Regulation (EEC) No 3821/85 on recording equipment in road transport and amending Regulation (EC) No 561/2006 of the European Parliament and the Council (First Reading). The UK supports the proposal which strikes a sensible balance between improving the security of the tachograph whilst ensuring that additional burdens on industry and enforcement authorities are minimised.

The Council will be expected to adopt a proposal for a Council decision on the signing, on behalf of the European Union, and provisional application of the Agreement providing a general framework for enhanced cooperation between the European Union and the European Organisation for the Safety of Air Navigation (Eurocontrol). The UK supports the proposed Agreement. It is important that the significant work Eurocontrol performs on behalf of the European Union is put on a sound contractual and financial basis to help ensure value for money from the proposed €40 million expenditure over four years.",written-statement,making-sure-uk-airports-and-airlines-are-safe-secure-and-competitive-while-reducing-their-impacts-on-the-environment-and-communities,sustaining-a-thriving-maritime-sector,patrick-mcloughlin,,department-for-transport,25-Oct-2012,2012-10-25
new,http://www.dft.gov.uk/news/statements/mcloughlin-20121029a,Statement on West Coast Main Line and franchising,"Oral statement by the the Rt Hon Patrick McLoughlin, Secretary of State for Transport.","Mr Speaker, with permission I would like to make a statement on the progress we are making to put right arrangements for the West Coast Main Line and rail franchising.

First, I will update the House on the Laidlaw Inquiry.

Second, I will explain how we will ensure not only continuity of service on the West Coast line after December 9th but an enhanced service.

On the 3rd of October I announced the cancellation of the competition to run the Inter-City West Coast franchise…

…because of the discovery of unacceptable flaws in the procurement process run by the Department for Transport.

I made it clear at the time, and do so again today, that this was a very regrettable decision prompted by mistakes that should never have happened.

I also launched two independent inquiries, one of which has reported its [interim findings](http://www.dft.gov.uk/publications/laidlaw-inquiry-interim-report) to me and which I am today delivering to the House.

I asked the first inquiry, led by Centrica chief executive Sam Laidlaw, to look into what happened and why…

…with the aim of establishing the lessons to be learned.

I also asked the second review, led by Eurostar chairman Richard Brown, to focus on any lessons to be learned for the future rail franchising programme.

I promised that both would conduct their investigations thoroughly, independently and urgently.

Mr Speaker, given the public interest in this matter the Laidlaw Inquiry was asked to deliver an interim report to me by the 26th October, and a final report by the end of November.

I am grateful to the Inquiry for meeting this first deadline, and working tirelessly to meet the second.

I stress that today's findings are precisely that - an interim report. There is more work to do. These findings are clearly a first stage.

As Mr Laidlaw explains, they set out what went wrong, and from that basis he will now carry out further investigations into why this happened.

From the start, my aim in dealing with this situation has been to be open, and come forward with information for the House at the earliest opportunity.

It is in that spirit that I make this statement today.

In the interests of complete transparency, I am publishing this interim report, with its provisional findings, and placing copies of it in the Libraries of both Houses.

To be blunt, these initial findings make uncomfortable reading but they provide a necessary and welcome further step in sorting this out.

The Government will need to see the full and finished report before it can comment in detail on any conclusions.

This is crucial because of the independent nature of the Laidlaw Inquiry and the need for the Government not to pre-judge its eventual findings.

But it is clear that the Inquiry has identified a number of issues which confirm that my decision to cancel the franchise competition was necessary.

These include…

…a lack of transparency in the bidding process…

…the fact that published guidance was not complied with when bids were being processed…

…inconsistencies in the treatment of bidders…

…and confirmation of technical flaws in the model used to calculate the amount of risk capital bidders were asked to provide to guard against the risk of default.

The Laidlaw Inquiry also mentions factors ""that appear to have caused or contributed to the issues raised"".

We will look at these with interest and care, although once again we will need to see the final report before we can comment further.

Secondly, I would like to update the House on the progress we are making to ensure continuity of service on the West Coast Main Line once the current franchise expires on the 9th of December.

As I have said previously, we will ensure that passengers continue to be served by the same trains, with the same frontline staff, the same services, using the same tickets…

…and, I am pleased to say, enhanced future timetables.

The Department is making good progress in its discussions with Virgin on how they will operate the line for a short period of up to 14 months while a competition is run for an interim agreement.

We are discussing their proposals for improved services over this period and an enhanced compensation scheme for delayed passengers.

In dealing with this, my Department has been frank and open about its mistakes and is absolutely determined to find out exactly what happened.

In the meantime, we will keep delivering for passengers and continue with the unprecedented levels of investment in trains, stations and railway lines.

Combined with our decision to limit train fare rises to an average of inflation plus one per cent, instead of RPI+3, for the next three years…

…this demonstrates this government's total commitment to Britain's railways.

I commend this statement to the House.",oral-statement,expanding-and-improving-the-rail-network,,patrick-mcloughlin,,department-for-transport,29-Oct-2012,2012-10-29
