http://www.communities.gov.uk/publications/planningandbuilding/relaxationchangeconsultation,Relaxation of planning rules for change of use from commercial to residential: Consultation,department-for-communities-and-local-government,Changing land use from commercial to residential,"This consultation seeks views on the government's proposals to amend the _Town and Country Planning (General Permitted Development) Order 1995_  to grant permitted development rights to changes of use from commercial to residential, ie to allow such changes of use without the need for planning applications.",8-Apr-2011,30-Jun-2011,9781409829218,,,,making-the-planning-system-work-more-efficiently-and-effectively,,,,3-Jul-2012,http://www.communities.gov.uk/documents/planningandbuilding/pdf/2172423.pdf,Changing land use from commercial to residential consultation: summary of responses and government response,"In April 2011 the Government published a consultation paper seeking views on granting permitted development rights to change use of buildings from commercial to residential use.

This report provides a summary of the 714 responses received in response to the consultation.",9781409835653,,,,,,,,,,,,http://www.communities.gov.uk/documents/planningandbuilding/pdf/1883189.pdf,Relaxation of planning rules for change of use from commercial to residential: Consultation,,,,,,,,,,,,,,,,,,,,,,,,,,,,,,,,,,,,,,,,,,,,
http://www.communities.gov.uk/publications/housing/drafthradirections,The Draft Housing Revenue Account (Accounting Practices) Directions 2011,department-for-communities-and-local-government,Housing revenue account: accounting practices,"Under Section 87(2) of the Local Government and Housing Act 1989, the Secretary of State for Communities and Local Government is required to consult representatives of local government and relevant professional bodies before making new directions and determinations, or before varying existing directions and determinations.

Various items of published guidance concerning the housing revenue account have recently been changed or updated, particularly the stock valuation guidance. The current direction in force is the housing revenue account (accounting practices) directions 2007, and the Department for Communities and Local Government wishes to update that document to reflect this and other changes that have taken place during 2010-11.",1-Apr-2011,12-May-2011,9781409829232,,,,improving-the-rented-housing-sector,,,,,,,,,,,,,,,,,,,,http://www.communities.gov.uk/documents/housing/pdf/1878540.pdf,The Draft Housing Revenue Account (Accounting Practices) Directions 2011,,,,,,,,,,,,,,,,,,,,,,,,,,,,,,,,,,,,,,,,,,,,
http://www.communities.gov.uk/publications/localgovernment/localpublicauditconsult,Future of local public audit: Consultation,department-for-communities-and-local-government,Future of local public audit,"On the 13 August 2010 the Secretary of State for Communities and Local Government announced plans to disband the Audit Commission, and refocus audit of local public bodies on helping local people hold those bodies to account for local spending decisions, the very essence of localism.

The aim is to replace the current, centralised audit systems managed by the Audit Commission, with a new decentralised regime, which will support local democratic accountability, and one that will also cut bureaucracy and costs, while ensuring that there continues to be robust local public audit. This consultation sets out proposals on the new audit framework where:

  * audit quality is regulated within a statutory framework, overseen by the National Audit Office and the accountancy profession
  * local public bodies will be free to appoint their own external auditors with stringent safeguards for independence",30-Mar-2011,30-Jun-2011,9781409829331,,,,making-local-councils-more-transparent-and-accountable-to-local-people,,,,4-Jan-2012,http://www.communities.gov.uk/documents/localgovernment/pdf/2060683.pdf,Future of local public audit consultation: summary of responses,"From March to June 2011, the government consulted interested parties on its proposals for the new audit framework. These proposals build on the statutory arrangements and professional ethical and technical standards that currently apply in the private sector with adaptations to ensure that the principles of public sector audit are maintained. The consultation closed on 30 June 2011 and the summary of responses has now been published.",9781409832836,http://www.communities.gov.uk/documents/localgovernment/pdf/2060619.pdf,Future of local public audit consultation: government response,9781409832829,,,,,,,,,http://www.communities.gov.uk/documents/localgovernment/pdf/1876169.pdf,Future of local public audit: Consultation,,,,,,,,,,,,,,,,,,,,,,,,,,,,,,,,,,,,,,,,,,,,
http://www.communities.gov.uk/publications/localgovernment/scaconsultation2011,Sustainable Communities Act 2007: Inspiring the Big Society - a consultation on regulations under the Sustainable Communities Act,department-for-communities-and-local-government,Sustainable Communities Act 2007 regulations,"On 15 December 2010 the Secretary of State for Communities and Local Government issued a second invitation to local authorities under the Sustainable Communities Act 2007 ('The Act'). He invited councils to consult people, ask them how they would like to see their local area improved and to take whatever action they see fit to make it happen.

If councils, having consulted and reached agreement with their local communities, find that a bureaucratic barrier prevents them from taking action, they can submit a formal 'proposal' asking government to remove the barrier through the online portal at [barrierbusting.communities.gov.uk](http://barrierbusting.communities.gov.uk/) (external link). This portal is also open to anyone who wishes to ask the government to remove a barrier which is stopping local action. We would, for example, welcome requests to remove barriers from organisations such as town and parish councils, and County Associations of Parish Councils.

The Act was amended in April 2010 to allow the procedures for receiving, considering and deciding proposals under the Act to be improved.

The Act now allows the arrangements for the consideration of proposals submitted in response to the invitation to be set out in regulations, following a period of consultation. There will be no deadlines for the submission of proposals, which can now be submitted straight to the government at any time. Information on the action the government is taking on the proposals will be available online so that councils and communities can track progress.

The Act, and the proposed draft regulations set out in this consultation, is a means to hold government to account and ensure each proposal is given the fullest consideration.",29-Mar-2011,20-Jun-2011,9781409828792,,,,giving-people-more-power-over-what-happens-in-their-neighbourhood,,,,13-Jun-2012,http://www.communities.gov.uk/documents/localgovernment/pdf/2160479.pdf,Sustainable Communities Act consultation on regulations: summary of responses and government response,"The Department ran a consultation exercise between 29 March and 20 June 2011 on new, light-touch, regulations to govern the implementation of the Sustainable Communities Act 2007. The consultation proposed the regulations that would be required to implement the second invitation of the Sustainable Communities Act. This publication summarises the responses received and Government's response.",9781409835134,,,,,,,,,,,,http://www.communities.gov.uk/documents/localgovernment/pdf/1875242.pdf,Sustainable Communities Act 2007: Inspiring the Big Society: a consultation on regulations under the Sustainable Communities Act,,,,,,,,,,,,,,,,,,,,,,,,,,,,,,,,,,,,,,,,,,,,
http://www.communities.gov.uk/publications/planningandbuilding/architectsactconsultation,Proposed amendments to the Architects Act 1997: Consultation,department-for-communities-and-local-government,Recognising professional architects' qualifications across the EU,"This consultation looks at an amendment to the Architects Act 1997 (as amended) in relation to the mutual recognition of professional qualifications. These provisions set out how professionals can obtain recognition of their qualifications when moving between Nation States within the EU in order to support greater freedom of movement within the Single Market.

The Architects Act sets out the basic criteria for automatic recognition of qualifications for architects. The way in which this part of the Act is currently drafted could have the potential to give rise to conditions prejudicial to the automatic recognition of qualifications held by other EU nationals who are seeking to practice as architects in the UK and who would be entitled to practice as architects in their home nation.",1-Mar-2011,25-Apr-2011,9781409828013,,,,making-the-planning-system-work-more-efficiently-and-effectively,,,,,,,,,,,,,,,,,,,,http://www.communities.gov.uk/documents/planningandbuilding/pdf/1854661.pdf,Consultation on proposed amendments to the Architects Act 1997,,,,,,,,,,,,,,,,,,,,,,,,,,,,,,,,,,,,,,,,,,,,
http://www.communities.gov.uk/publications/localgovernment/codepracticeladataconsult,Code of recommended practice for local authorities on data transparency - Consultation,department-for-communities-and-local-government,Local authorities data transparency code,The proposed code is concerned with making data generated by authorities available and accessible to the public. It is intended to set out the requirement to publish data and minimum expectations and considerations.,7-Feb-2011,14-Mar-2011,9781409827801,,,,making-local-councils-more-transparent-and-accountable-to-local-people,,,,29-Sep-2011,http://www.communities.gov.uk/documents/localgovernment/pdf/1985219.pdf,Local authorities data transparency code consultation: summary of responses and government response,"The government consulted on a new code of recommended practice for local authorities on the publication of data in February 2011. The proposed code was concerned with making data generated by authorities available and accessible to the public.

This document provides a summary of responses to the consultation and the government's response.",9781409831099,,,,,,,,,,,,http://www.communities.gov.uk/documents/localgovernment/pdf/1829193.pdf,Code of recommended practice for local authorities on data transparency - consultation,,,,,,,,,,,,,,,,,,,,,,,,,,,,,,,,,,,,,,,,,,,,
http://www.communities.gov.uk/publications/localgovernment/righttochallengeconsultation,Proposals to introduce a Community Right to Challenge: Consultation paper,department-for-communities-and-local-government,Community Right to Challenge,"This document sets out the provisions being made by government in the Localism Bill to introduce a Community Right to Challenge. It seeks views on the detail of how the right will work in practice, which will be set out in regulations. It also invites views on what type of support and guidance should be provided.",4-Feb-2011,3-May-2011,9781409828037,,,,giving-people-more-power-over-what-happens-in-their-neighbourhood,,,,2-Aug-2011,http://www.communities.gov.uk/documents/localgovernment/pdf/19581851.pdf,Community Right to Challenge consultation: summary of responses,A summary of the responses received to the _Proposals to introduce a Community Right to Challenge: consultation paper_ originally published on 4 February 2011.,9781409830702,,,,,,,,,,,,http://www.communities.gov.uk/documents/localgovernment/pdf/1835810.pdf,Proposals to introduce a Community Right to Challenge: Consultation paper,,,,,,,,,,,,,,,,,,,,,,,,,,,,,,,,,,,,,,,,,,,,
http://www.communities.gov.uk/publications/localgovernment/righttobuyconsultation,Proposals to introduce a Community Right to Buy - assets of community value: Consultation paper,department-for-communities-and-local-government,Community Right to Bid,"This document sets out the provisions being made by government in the Localism Bill to assist community organisations who wish to purchase assets of community value. It seeks views on the detail of how the scheme should be delivered, which will be set out in regulations. It also invites views on what type of support and guidance should be provided.",4-Feb-2011,3-May-2011,9781409828020,,,,giving-people-more-power-over-what-happens-in-their-neighbourhood,,,,12-Aug-2011,http://www.communities.gov.uk/documents/localgovernment/pdf/1965426.pdf,Community Right to Bid consultation: summary of responses,A summary of the responses received to the Community Right to Buy - Assets of Community Value consultation paper originally published on 4 February 2011.,9781409830757,,,,,,,,,,,,http://www.communities.gov.uk/documents/localgovernment/pdf/1835775.pdf,Proposals to introduce a Community Right to Buy - Assets of Community Value: Consultation paper,http://www.communities.gov.uk/documents/communities/pdf/2168557.pdf,Community Right to Bid - Impact Assessment: Localism Act 2011,,,,,,,,,,,,,,,,,,,,,,,,,,,,,,,,,,,,,,,,,,
http://www.communities.gov.uk/publications/localgovernment/revisionaccountsregs2003consult,Revision and consolidation of the Accounts and Audit Regulations 2003 (SI 2003 No 533) as amended: Consultation,department-for-communities-and-local-government,Accounts and Audit Regulations 2003,"This consultation invites views on the draft consolidation of the Accounts and Audit Regulations 2003 and 4 amending instruments, and incorporation of a series of technical amendments.

The proposed changes include:

  * an increase in the threshold below which a body is classed as a smaller body
  * a revised procedure for the approval and publication of statements of accounts and other accounting statements
  * new provision for the accounts of Passenger Transport Executives
  * the removal of criminal penalties for non-compliance with the regulations

The draft also restructures the regulations with the aim of making them easier to follow.

This consultation is part of a regular series of updates to the Accounts and Audit Regulations designed to keep them in line with developments in financial governance, accounting and audit.

Previous updates were made most recently in 2003, 2006, and 2009.",24-Jan-2011,8-Mar-2011,9781409827818,,,,making-local-councils-more-transparent-and-accountable-to-local-people,,,,,,,,,,,,,,,,,,,,http://www.communities.gov.uk/documents/localgovernment/pdf/1824755.pdf,Revision and consolidation of the Accounts and Audit Regulations 2003 (SI 2003 No 533) as amended: Consultation,,,,,,,,,,,,,,,,,,,,,,,,,,,,,,,,,,,,,,,,,,,,
http://www.communities.gov.uk/publications/fire/fireandrescuecontrolservices,The future of fire and rescue control services in England - Consultation,department-for-communities-and-local-government,The future of fire and rescue control services in England,This consultation seeks the views from the fire and rescue sector on the future arrangements of fire and rescue control services in England following the decision to close down the FiReControl project.,13-Jan-2011,8-Apr-2011,9781409827276,,,,supporting-fire-and-rescue-authorities-to-reduce-the-number-and-impact-of-fires,,,,5-Jul-2011,http://www.communities.gov.uk/documents/fire/pdf/1936876.pdf,The future of fire and rescue control services in England consultation: summary of responses,This is a summary of responses to the recent consultation on the future of fire and rescue control services in England consultation.,9781409830382,,,,,,,,,,,,http://www.communities.gov.uk/documents/fire/pdf/1815528.pdf,The future of fire and rescue control services in England - Consultation,,,,,,,,,,,,,,,,,,,,,,,,,,,,,,,,,,,,,,,,,,,,
http://www.communities.gov.uk/publications/fire/frsdatreturnsfosiconsultation,Reductions of annual returns data collected from Fire and Rescue Services and of Fires of Special Interest reporting - Consultation,department-for-communities-and-local-government,Reducing annual returns and 'fires of special interest' data from fire and rescue authorities,The statistical consultation seeks the views on a reduction in non-financial annual returns from fire and rescue authorities and fires of special interest reporting.,26-Nov-2010,14-Jan-2011,9781409826590,,,,supporting-fire-and-rescue-authorities-to-reduce-the-number-and-impact-of-fires,,,,18-Mar-2011,http://www.communities.gov.uk/documents/fire/pdf/1866807.pdf,Reducing annual returns and 'fires of special interest' data from fire and rescue authorities consultation: summary of responses,A summary of responses to the consultation on proposals to the reduction to annual returns data collected from fire and rescue services and to 'fires of special interest' reporting.,9781409829164,,,,,,,,,,,,http://www.communities.gov.uk/documents/fire/pdf/1779370,Reductions of annual returns data collected from Fire and Rescue Services and of Fires of Special Interest reporting - Consultation,,,,,,,,,,,,,,,,,,,,,,,,,,,,,,,,,,,,,,,,,,,,
http://www.communities.gov.uk/publications/housing/socialhousingreform,Local decisions: a fairer future for social housing,department-for-communities-and-local-government,A fairer future for social housing,"This document sets out the government's plans for radical reform to the social housing system. It includes changes on:

* tenure
* management of waiting lists
* homelessness duty.

It also covers the introduction of a new 'affordable rent' tenancy and changes to the system of council housing finance. It includes measures to improve mobility, tackle overcrowding and under-occupation. The reforms will ensure that social landlords can make better use of social housing and target support where it is needed most.",22-Nov-2010,17-Jan-2011,9781409826460,,,,improving-the-rented-housing-sector,,,,28-Feb-2011,http://www.communities.gov.uk/documents/housing/pdf/1853054.pdf,A fairer future for social housing consultation: summary of responses,"This document summarises responses to the consultation paper, _Local decisions: a fairer future for social housing_, and indicates the government's intentions on next steps in the reform of social housing.",9781409828617,,,,,,,,,,,,http://www.communities.gov.uk/documents/housing/pdf/1775577.pdf,Local decisions: a fairer future for social housing,http://www.communities.gov.uk/documents/housing/pdf/1775586.pdf,Local decisions: a fairer future for social housing - Summary,,,,,,,,,,,,,,,,,,,,,,,,,,,,,,,,,,,,,,,,,,
http://www.communities.gov.uk/publications/planningandbuilding/planningfeesconsultation,Proposals for changes to planning application fees in England: Consultation,department-for-communities-and-local-government,Planning application fees,"This consultation paper seeks views on proposed changes to the planning application fees regime which would decentralise responsibility for setting fees to local planning authorities. We also propose to allow authorities to charge for resubmitted applications and to set higher fees for retrospective applications.

Proposals will help to reduce the subsidising of planning applications by local taxpayers. If accepted and approved by Parliament, the changes would be implemented from April 2011, with a 6-month transition period until October 2011.",15-Nov-2010,7-Jan-2011,9781409826101,,,,making-the-planning-system-work-more-efficiently-and-effectively,giving-communities-more-power-in-planning-local-development,,,3-Aug-2012,http://www.communities.gov.uk/documents/planningandbuilding/pdf/2191829.pdf,Proposals for changes to planning application fees in England consultation: summary of responses,This document is a summary of the responses made to the consultation on proposed changes to the planning application fees regime which ran from 15 November 2010 to 7 January 2011.,9781409835882,,,,,,,,,,,,http://www.communities.gov.uk/documents/planningandbuilding/pdf/1769286.pdf,Proposals for changes to planning application fees in England: Consultation,,,,,,,,,,,,,,,,,,,,,,,,,,,,,,,,,,,,,,,,,,,,
http://www.communities.gov.uk/publications/housing/newhomesbonusconsult,New homes bonus: Consultation,department-for-communities-and-local-government,New Homes Bonus,"This consultation seeks views on the implementation of the _New Homes Bonus_ - which will provide a powerful, simple, transparent and permanent means of incentivising local authorities to increase their housing supply.

This follows the coalition agreement to provide incentives for local authorities to deliver sustainable development, including for new homes and businesses.",12-Nov-2010,24-Dec-2010,9781409826125,,,,increasing-the-number-of-available-homes,,,,17-Feb-2011,http://www.communities.gov.uk/documents/housing/pdf/1846533.pdf,New Homes Bonus consultation: summary of responses,"The government's proposed scheme design was published in the New Home Bonus consultation on 12 November 2010 which set out the details of the scheme and the rationale for the proposed mechanisms. It also set out how the scheme sits within the wider context of the government's locally driven growth strategy.

The consultation was largely technical and aimed primarily at local authorities. We received almost 500 responses in total. A full list of respondents can be found at Annex A of the summary document.",9781409828327,,,,,,,,,,,,http://www.communities.gov.uk/documents/housing/pdf/1767788.pdf,New homes bonus: Consultation,,,,,,,,,,,,,,,,,,,,,,,,,,,,,,,,,,,,,,,,,,,,
http://www.communities.gov.uk/publications/housing/hrasdeterminations201112,The Draft Housing Revenue Account Subsidy and the Draft Item 8 Credit and Item 8 Debit (General) Determinations 2011-2012,department-for-communities-and-local-government,Housing revenue account subsidy and draft item 8 credit and item 8 debit (general) determinations 2011-12,The draft housing revenue account subsidy and the draft Item 8 credit and item 8 debit (general) determinations 2011-12 together with supporting papers and explanatory notes.,5-Nov-2010,16-Dec-2010,978 14098 2631 6,,,,improving-the-rented-housing-sector,,,,,,,,,,,,,,,,,,,,http://www.communities.gov.uk/documents/housing/pdf/1761087.pdf,Covering letter to Chief Finance Officers/Chief Accountants of Local Housing Authorities in England,http://www.communities.gov.uk/documents/housing/pdf/1761077.pdf,The Draft Housing Revenue Account Subsidy Determination 2011-2012,http://www.communities.gov.uk/documents/housing/xls/1761562.xls,HRA Subsidy Determination 2011-12 - Data Outputs,http://www.communities.gov.uk/documents/housing/pdf/1761036.pdf,Commentary on the draft housing revenue account subsidy determination 2011-2012,http://www.communities.gov.uk/documents/housing/pdf/1761031.pdf,The Draft Item 8 Credit and Item 8 Debit (General) Determination 2011-2012,http://www.communities.gov.uk/documents/housing/pdf/1761042.pdf,Draft Commentary on the Item 8 Determination for 2011-2012,http://www.communities.gov.uk/documents/housing/pdf/1761081.pdf,"Rent Rebate Subsidy Limitation: Derogations 2011-2012, England",,,,,,,,,,,,,,,,,,,,,,,,,,,,,,,,
http://www.communities.gov.uk/publications/communities/futurecitizenshipsurvey,The Future of the Citizenship Survey,department-for-communities-and-local-government,The future of the citizenship survey,"The citizenship survey is a face-to-face household survey carried out by the Department for Communities and Local Government covering a representative core sample of almost 10,000 adults in England and Wales each year, plus a minority ethnic boost sample of 5,000 and a Muslim boost sample of 1,200.

This statistical consultation sets out the intention to cancel the future citizenship survey, and in doing so, seeks to identify the uses of the survey data, the implications of stopping and options for alternative information sources.",1-Nov-2010,30-Nov-2010,9781409826064,,,,bringing-people-together-in-strong-united-communities,,,,17-Mar-2011,http://www.communities.gov.uk/documents/communities/pdf/1866399.pdf,The future of the citizenship survey consultation: summary of responses,"As part of the current drive to deliver cost savings across government and to reduce the fiscal deficit, future citizenship surveys will be discontinued.

This report summarises the 61 reponses to the technical consultation _The future of the citizenship survey: consultation_ and includes the Department for Communities and Local Government's response. The 60 individual submissions are also published below.",9781409828983,http://www.communities.gov.uk/documents/communities/pdf/1866643.pdf,The future of the citizenship survey consultation: individual responses,,,,,,,,,,http://www.communities.gov.uk/documents/communities/pdf/1756366.pdf,The Future of the Citizenship Survey,,,,,,,,,,,,,,,,,,,,,,,,,,,,,,,,,,,,,,,,,,,,
