old_url,organisation,title,policy_1,policy_2,policy_3,policy_4,publication_type,body,price,ignore date,publication_date,ignore type,ISBN,attachment_0_url,attachment_0_title,attachment_1_url,attachment_1_title,attachment_2_url,attachment_2_title,attachment_3_url,attachment_3_title,attachment_4_url,attachment_4_title,attachment_5_url,attachment_5_title,attachment_6_url,attachment_6_title,attachment_7_url,attachment_7_title,attachment_8_url,attachment_8_title
http://www.communities.gov.uk/publications/housing/guidancenote,department-for-communities-and-local-government,Guidance note on Empty Dwelling Management Orders,increasing-the-number-of-available-homes,,,,guidance,"The Government is committed to finding solutions to the problems posed by empty homes. As well as restricting housing supply, empty homes represent waste and missed opportunity. They blight communities, attract vandals and squatters and tie up the resources of LHAs and the emergency services. A dwelling that is left unoccupied and not maintained will, over time, begin to impact on its surroundings and is at risk from being broken into by vandals and squatters. Neighbouring properties can be affected by the physical decline of a poorly maintained property. The only effective way to reduce the negative impact of an empty dwelling is to secure its occupation. It is therefore of public interest that empty homes are brought back into use.

This guidance note is intended to assist local housing authorities (""LHAs"") in understanding the powers contained in the _Housing Act 2004_ (""the Act"") relating to Empty Dwelling Management Orders (""EDMOs""). It is not intended to be an authoritative interpretation of the legislation and readers must not rely on it as an authoritative source. Where there are any doubts about the interpretation of the legislation readers are strongly advised to seek their own independent legal advice.

This guidance note is intended to apply to England.",Free,10 July 2006,10-Jul-2006,Good practice and guidance,,http://www.communities.gov.uk/documents/housing/pdf/151111.pdf,Guidance Note on Empty Dwelling Management Orders,,,,,,,,,,,,,,,,
http://www.communities.gov.uk/publications/housing/familyinterventionguide,department-for-communities-and-local-government,Guidance on the use of Family Intervention Tenancies,improving-the-rented-housing-sector,,,,guidance,"This guidance is aimed at social landlords and their use of Family Intervention Tenancies. These tenancies were introduced in the Housing and Regeneration Act 2008 (""the 2008 Act"") and became available for use on 1 January 2009.

This guidance outlines what considerations social landlords, Family Intervention Projects and other agencies involved in delivering support to households who have been involved in anti-social behaviour should make when considering the use of Family Intervention Tenancies.",Free,19 January 2009,19-Jan-2009,"Good practice and guidance, Reports and summaries",9781409810322,http://www.communities.gov.uk/documents/housing/pdf/familyinterventiontenancies.pdf,Guidance on the use of Family Intervention Tenancies,http://www.communities.gov.uk/documents/housing/doc/familyinterventiontenancies.doc,Guidance on the use of Family Intervention Tenancies,,,,,,,,,,,,,,
http://www.communities.gov.uk/publications/housing/guidesocial,department-for-communities-and-local-government,Guide to social rent reforms,improving-the-rented-housing-sector,,,,guidance,"In December 2000 the Department published a policy statement, _Quality and Choice: A Decent Home for All - The Way Forward for Housing_, which proposed that rent setting in the social housing sector should be brought onto a common system based upon relative property values and local earnings levels. This guide sets out the details underpinning the policy statement and provides background information on the implications of the proposals for tenants and landlords.",Free,1 March 2001,01-Mar-2001,Good practice and guidance,,http://www.communities.gov.uk/documents/housing/pdf/139187.pdf,Guide to social rent reforms,,,,,,,,,,,,,,,,
http://www.communities.gov.uk/publications/housing/guideeffective,department-for-communities-and-local-government,Guide to effective use of enforcement powers - Part 1: unauthorised encampments,providing-housing-support-for-older-and-vulnerable-people,,,,guidance,"This document is intended for elected officals and others in the community who have an interest in how unauthorised camping by Gypsies and Travellers is managed in their area. It provides information  to local authority officers and landlowners on options for dealing with incidents of unauthorised camping.

This guidance was produced to meet the Government's objective to ensure that the settled community and Gypsies and Travellers live together peacefully. ",Free,2 February 2006,02-Feb-2006,Good practice and guidance,,http://www.communities.gov.uk/documents/housing/pdf/143582.pdf,Guide to effective use of enforcement powers - Part 1: Unauthorised encampments,,,,,,,,,,,,,,,,
http://www.communities.gov.uk/publications/housing/accommodationassessments,department-for-communities-and-local-government,Gypsy and traveller accommodation needs assessments: guidance,providing-housing-support-for-older-and-vulnerable-people,,,,guidance,"This guidance aims to provide advice on carrying out an assessment of the accommodation needs of Gypsies and Travellers. It is not exhaustive or prescriptive. While it is recommended that the basic principles outlined here should be followed, the exact approach will need to be adapted to local circumstances.

This guidance sets out:

  * why the Accommodation Needs Assessment has to be done

  * what it should produce

  * whom it should survey

  * key differences between the Gypsy and Traveller community and others, and the practical implications of these differences

  * how 'accommodation need' for Gypsies and Travellers differs from that for the settled community

  * timescales for carrying out and updating the assessment",Free,4 October 2007,04-Oct-2007,"Reports and summaries, Good practice and guidance",,http://www.communities.gov.uk/publications/housing/accommodationassessments?view=Order+form&supplierId=1403822,Order this publication,http://www.communities.gov.uk/documents/housing/pdf/accommneedsassessments.pdf,Gypsy and Traveller Accommodation Needs Assessments: Guidance,http://www.communities.gov.uk/documents/housing/doc/accom-needs-assessments.doc,Gypsy and Traveller Accommodation Needs Assessments: Guidance,,,,,,,,,,,,
http://www.communities.gov.uk/publications/housing/hhsrsoperatingguidance,department-for-communities-and-local-government,HHSRS Operating Guidance  - Housing Act 2004: Guidance about inspections and assessment of hazards given under Section 9,improving-the-rented-housing-sector,,,,guidance,"The Housing Health and Safety Rating System (HHSRS) is a risk based evaluation tool to help local authorities identify and protect against potential risks and hazards to health and safety from any deficiencies identified in dwellings. It was introduced under the Housing Act 2004 and came into effect on 6 April 2006.   It applies to residential properties in England.

The HHSRS assesses 29 categories of housing hazard, each hazard has a weighting which will help determine whether the property is rated as having Category 1 (serious) or Category 2 (other) .

An electronic 'hazard survey' programme for use with hand-held computers is associated with the Operating Guidance and is available in the form of a CD-Rom.  A copy of the disc will be sent with the guidance and are not available separately.",£50.00 (free to download below),27 February 2006,27-Feb-2006,Good practice and guidance,139781851128464 and 101851128468,http://www.communities.gov.uk/documents/housing/pdf/142631.pdf,HHSRS Operating Guidance - Housing Act 2004: Guidance about inspections and assessment of hazards given under Section 9,,,,,,,,,,,,,,,,
http://www.communities.gov.uk/publications/housing/homelessnesscode,department-for-communities-and-local-government,Homelessness code of guidance for local authorities: July 2006,providing-housing-support-for-older-and-vulnerable-people,,,,guidance,"The Code provides statutory guidance on local authority housing and social services statutory functions in respect of people who are homeless or at risk of homelessness. The Code is issued by the Secretaries of State under section 182 of the Housing Act 1996, and local authorities must have regard to the Code, by law.",£18.00 (free to download below),24 July 2006,24-Jul-2006,Good practice and guidance,978-1-85112-860-0,http://www.communities.gov.uk/publications/housing/homelessnesscode?view=Order+form&supplierId=1403826,Order this publication,http://www.communities.gov.uk/documents/housing/pdf/152056.pdf,Homelessness Code of Guidance for Local Authorities (2006),,,,,,,,,,,,,,
http://www.communities.gov.uk/publications/housing/intentionalhomelessnessguide,department-for-communities-and-local-government,Homelessness code of guidance for local authorities: supplementary guidance on intentional homelessness,providing-housing-support-for-older-and-vulnerable-people,,,,guidance,"In response to the current economic climate, and the robust framework of financial support the Government has put in place to help homeowners in financial difficulty, this note provides guidance on how local housing authorities should exercise their homelessness functions, and apply the various statutory criteria, when considering whether applicants who are homeless having lost  their home because of difficulties in meeting mortgage commitments are intentionally or unintentionally homeless.

This guidance is issued by the Secretary of State under s.182 of the Housing Act 1996 (""the 1996 Act""). Under s.182(1) of the 1996 Act, housing authorities are required to have regard to this guidance in exercising their functions under Part 7 of the 1996 Act.

This statutory guidance supplements Chapter 11 of the Homelessness Code of Guidance for Local Authorities issued in July 2006 (""the 2006 Code""), and should be read in conjunction with that chapter.",Free,5 August 2009,05-Aug-2009,"Good practice and guidance, Legislation and policy",9781409817499,http://www.communities.gov.uk/publications/housing/intentionalhomelessnessguide?view=Order+form&supplierId=1403822,Order this publication,http://www.communities.gov.uk/documents/housing/pdf/1304826,Homelessness Code of Guidance for Local Authorities: Supplementary Guidance on Intentional Homelessness,http://www.communities.gov.uk/documents/housing/doc/1310043.doc,Homelessness Code of Guidance for Local Authorities: Supplementary Guidance on Intentional Homelessness,,,,,,,,,,,,
http://www.communities.gov.uk/publications/housing/homelessnesscommencement,department-for-communities-and-local-government,"Homelessness legislation: Commencement of Section 314 of, and Schedule 15 to, the Housing and Regeneration Act 2008",providing-housing-support-for-older-and-vulnerable-people,,,,guidance,"This letter informs local housing authorities in England that the Government intends to commence section 314 of, and Schedule 15 to, the Housing and Regeneration Act 2008 on 2 March 2009. This will remedy the incompatibility with the European Convention on Human Rights of section 185(4) of the Housing Act 1996, (a provision of the homelessness legislation).",Free,5 March 2009,05-Mar-2009,"Circular and official letters, Legislation and policy",,http://www.communities.gov.uk/documents/housing/pdf/1155611.pdf,"Homelessness Legislation: Commencement of Section 314 of, and Schedule 15 to, the Housing and Regeneration Act 2008",,,,,,,,,,,,,,,,
http://www.communities.gov.uk/publications/housing/homelessnessinformationsheetdent,department-for-communities-and-local-government,Homelessness and health information sheet: dental services (HIS number 3),providing-housing-support-for-older-and-vulnerable-people,,,,guidance,Homeless people can face major barriers in accessing dental services - while their life circumstances can often mean they are among those most in need of treatment. This information sheet provides information on how local authorities and health services can work together to provide accessible and appropriate dental services for homeless people.,Free,18 January 2006,18-Jan-2006,Reports and summaries,,http://www.communities.gov.uk/documents/housing/pdf/137860.pdf,Homelessness and Health Information Sheet: Number 3 - Dental Services,,,,,,,,,,,,,,,,
http://www.communities.gov.uk/publications/housing/homelessnessinformation,department-for-communities-and-local-government,Homelessness and health information sheet: health visiting services (HIS number 2),providing-housing-support-for-older-and-vulnerable-people,,,,guidance,"Homeless people can face great inequalities in accessing health services, yet their health can often suffer from being homeless or living in poor quality temporary accommodation. This information sheet gives information on health visiting services and provides examples of good practice.",Free,18 January 2006,18-Jan-2006,Reports and summaries,,http://www.communities.gov.uk/documents/housing/pdf/137863.pdf,Homelessness and Health Information Sheet: Number 2 - Health Visiting Services,,,,,,,,,,,,,,,,
http://www.communities.gov.uk/publications/housing/homelessnessinformationsheethosp,department-for-communities-and-local-government,Homelessness and health information sheet: hospital discharge (HIS number 4),providing-housing-support-for-older-and-vulnerable-people,,,,guidance,"Homeless people may often leave health problems untreated until they reach crisis point and then need to rely on treatment at Accident and Emergency (A&E) or will present at other primary health services with multiple and entrenched problems. This combines to make health problems more expensive to treat, hospital and A&E waiting lists longer and can lead to people being less able to support themselves and their families in their accommodation.

This information sheet provides information on how local authorities and health services can work together to provide accessible and appropriate services for homeless people.",Free,18 January 2006,18-Jan-2006,Reports and summaries,,http://www.communities.gov.uk/publications/housing/homelessnessinformationsheethosp?view=Order+form&supplierId=1403822,Order this publication,http://www.communities.gov.uk/documents/housing/pdf/137857.pdf,Homelessness and Health Information Sheet: Number 4 - Hospital Discharge,,,,,,,,,,,,,,
http://www.communities.gov.uk/publications/housing/homelessnesshealth,department-for-communities-and-local-government,Homelessness and health information sheet: personal medical services (HIS number 1),providing-housing-support-for-older-and-vulnerable-people,,,,guidance,"Homeless people can face great inequalities in accessing health services, yet their health can often suffer from being homeless or living in poor quality temporary accommodation.

This information sheet looks at Personal Medical Services schemes (PMS), which offer opportunities to provide services to groups experiencing difficulty accessing General Medical Services. It presents a number of case studies of successful PMS projects around the country.",Free,28 November 2002,28-Nov-2002,Reports and summaries,,http://www.communities.gov.uk/documents/housing/pdf/137866.pdf,Homelessness and Health Information Sheet: Number 1 - Personal Medical Services,,,,,,,,,,,,,,,,
http://www.communities.gov.uk/publications/housing/homelessnesspreventionguide,department-for-communities-and-local-government,Homelessness prevention and meeting housing need for (ex)offenders: A guide to practice,providing-housing-support-for-older-and-vulnerable-people,,,,guidance,"This guide aims to assist those who work with (ex)offenders to help prevent them from becoming homeless and to meet their housing needs. It focuses on three main areas:

  * partnership working to increase capacity in housing provision,
  * multi-agency approaches to assessment and planning,
  * and the provision of on-going support.

It draws on existing initiatives to provide examples of practice.

The findings and recommendations in this report are those of the consultant authors and do not necessarily represent the views or proposed policies of the Department for Communities and Local Government.",Free,2 November 2009,02-Nov-2009,"Reports and summaries, Good practice and guidance",9781409814948,http://www.communities.gov.uk/documents/housing/pdf/1357348.pdf,Homelessness prevention and meeting housing need for (ex)offenders: A guide to practice,http://www.communities.gov.uk/documents/housing/doc/1357369.doc,Homelessness prevention and meeting housing need for (ex)offenders: A guide to practice,,,,,,,,,,,,,,
http://www.communities.gov.uk/publications/housing/hospitaladmission,department-for-communities-and-local-government,Hospital admission and discharge: people who are homeless or living in temporary or insecure accommodation,providing-housing-support-for-older-and-vulnerable-people,,,,guidance,"This publication relates to guidance to support hospitals, Primary Care Trusts (PCTs), local authorities and the voluntary sector, working in partnership, to develop an effective admission and discharge protocol for people who are not living in settled accommodation. The over arching aim of the protocol will be to ensure that no one is discharged to the streets or inappropriate accommodation.",Free,8 December 2006,08-Dec-2006,Good practice and guidance,,http://www.communities.gov.uk/documents/housing/pdf/154289.pdf,Hospital Admission and Discharge: People who are homeless or living in temporary or insecure accommodation,,,,,,,,,,,,,,,,
http://www.communities.gov.uk/publications/housing/deliveringhousingadaptations2,department-for-communities-and-local-government,Housing disrepair legal obligations: good practice guidance,improving-the-rented-housing-sector,,,,guidance,"The purpose of this guidance is to advise on good practice in relation to the management and delivery of housing repairs while emphasising the legal obligations and suggesting appropriate responses where there are threats of litigation.

A high quality repairs service is a key element in the provision of good quality rented housing. Also it is an essential element in achieving high levels of tenant satisfaction, improving the landlord and tenant relationship and protecting health and safety.

A number of local authorities and other landlords have an excellent record in the provision of housing repairs service, but there is scope for improvements, in some cases significant, by many others.",£10.00 (free to download below),8 January 2002,08-Jan-2002,Good practice and guidance,185112523X,http://www.communities.gov.uk/documents/housing/pdf/142949.pdf,Housing Disrepair Legal Obligations: Good Practice Guidance,,,,,,,,,,,,,,,,
http://www.communities.gov.uk/publications/housing/housinghealth,department-for-communities-and-local-government,Housing Health and Safety Rating System - guidance for landlords and property related professionals,improving-the-rented-housing-sector,,,,guidance,"The Housing Health and Safety Rating System (HHSRS) is a new risk assessment tool used to assess potential risks to the health and safety of occupants in residential properties in England and Wales. The legislation came into effect in England on 6 April 2006 and slightly later in 2006 in Wales.

This assessment method focuses on the hazards that are present in housing. Tackling these hazards will make housing healthier and safer to live in.

This guidance is aimed at non-specialists, in particular private landlords, to help them understand the requirements under the Housing Act 2004 in relation to the HHSRS and help them identify the type of work that is needed on their properties to conform with the HHSRS.",£12.00 (free to download below),26 May 2006,26-May-2006,Good practice and guidance,978 185 112 8563,http://www.communities.gov.uk/publications/housing/housinghealth?view=Order+form&supplierId=1403826,Order this publication,http://www.communities.gov.uk/documents/housing/pdf/150940.pdf,Housing Health and Safety Rating System - Guidance for Landlords and Property Related Professional,,,,,,,,,,,,,,
http://www.communities.gov.uk/publications/housing/housinghealth2,department-for-communities-and-local-government,Housing Health and Safety Rating System: enforcement guidance: Housing Act 2004 Part 1: Housing Conditions,improving-the-rented-housing-sector,,,,guidance,The Housing Health and Safety Rating System enforcement guidance is given to local housing authorities to provide guidance on the exercise of their duties and powers under Part 1 of the Housing Act 2004.,£15.00 (free to download below),23 August 2006,23-Aug-2006,"Good practice and guidance, Legislation and policy",9781851128471 (ISBN-13) ; 1851128476 (ISBN-10),http://www.communities.gov.uk/publications/housing/housinghealth2?view=Order+form&supplierId=1403826,Order this publication,http://www.communities.gov.uk/documents/housing/pdf/safetyratingsystem.pdf,Housing Health and Safety Rating System: Enforcement Guidance: Housing Act 2004 Part 1: Housing Conditions,,,,,,,,,,,,,,
http://www.communities.gov.uk/publications/housing/hramanual0607,department-for-communities-and-local-government,Housing Revenue Account Manual - 2006-2007 Edition,giving-local-authorities-more-control-over-how-they-spend-public-money-in-their-area,,,,guidance,"This manual describes the statutory rules governing both the keeping of the Housing Revenue Account (HRA) and the payment of subsidy to support it. It applies to English housing authorities. It also briefl y describes the policy behind these rules and explains their practical application. Finally, it places the HRA and HRA subsidy arrangements in the wider context of public expenditure and the local government capital finance system.

**Arrangement of the manual**

The manual is arranged in three parts:

(i) Part I: Introduction - covering the recent history and development of housing finance, and the local government capital finance system;

(ii) Part II: The Housing Revenue Account - covering accounting and budgeting procedures generally (for both the HRA and the Housing Repairs Account) and each HRA debit and credit Item in more detail;

(iii) Part III: HRA Subsidy - covering the general principles, the overall formula and each separate component within this, and claims procedures; worked examples are provided.

Information on extant directions and determinations for years from 1996-1997 onwards, and on contact points, together with a glossary of terms are included in the Appendices. There is also a comprehensive index.",Free,30 July 2007,30-Jul-2007,"Manuals leaflets and booklets, Good practice and guidance",,http://www.communities.gov.uk/documents/housing/pdf/hramanual0607.pdf,Housing Revenue Account Manual - 2006–2007 Edition,,,,,,,,,,,,,,,,
http://www.communities.gov.uk/publications/housing/housingallocationhomelessness,department-for-communities-and-local-government,"Housing allocation, homelessness and stock transfer: a guide to key issues",providing-housing-support-for-older-and-vulnerable-people,,,,guidance,"An ODPM commissioned study into the current operation of housing allocations policy by local authorities. The report also covers lettings to existing tenants and related aspects of homelessness administration.

_Note on quality: the files attached to this page were converted from a legacy website by automatic process, and may contain minor formatting errors. The text of the document is complete and as originally published._",Free,1 January 2004,01-Jan-2004,Good practice and guidance,,http://www.communities.gov.uk/documents/housing/pdf/138487.pdf,"Housing allocation, homelessness and stock transfer: A guide to key issues",http://www.communities.gov.uk/documents/housing/rtf/156843.rtf,"Housing allocation, homelessness and stock transfer: A guide to key issues",,,,,,,,,,,,,,
http://www.communities.gov.uk/publications/housing/goodpracticeguide,department-for-communities-and-local-government,Joint working between Housing and Children’s Services: preventing homelessness and tackling its effects on children and young people,providing-housing-support-for-older-and-vulnerable-people,,,,guidance,"The purpose of this guide is to help the managers of Children's Services and Housing Authorities in both single tier and two tier authorities to plan and deliver changes for children, young people and families. It is aimed at senior managers in housing and children's services.",Free,12 May 2008,12-May-2008,Good practice and guidance,9781409800163,http://www.communities.gov.uk/documents/housing/pdf/jointworkinghomelessness,"Joint working between Housing and Children's Services: Preventing homelessness and tackling its effects on children
and young people",http://www.communities.gov.uk/documents/housing/doc/jointworkinghomelessness,Joint working between Housing and Children's Services: Preventing homelessness and tackling its effects on children and young people,,,,,,,,,,,,,,
