ignore-status,old_url,title,summary,body,type,policy_1,policy_2,minister_1,location,organisation,delivered_date,ignoretextdate
new,http://www.dft.gov.uk/news/speeches/hammond-20121022a,Place West London conference,"Speech by Stephen Hammond, Parliamentary Under Secretary of State for Transport.","## Introduction

I'd like to begin by thanking Place London for inviting me to today's event, and to Richard [Barnes, Chair] for that kind introduction.

It's wonderful to see so many people here with an interest in this part of the city.

I may be new to this ministerial brief, but I'm not new to London. As MP for Wimbledon, this is my home patch.

So I can reassure you that investment in the infrastructure, regeneration, and the economy of West and South West London is very close to my heart.

This year we've seen London host a spectacular Olympic and Paralympic Games.

The Olympic Park might have been in East London, but the whole city embraced the Games, including West London with events at Wembley and Earl's Court.

London 2012 - we planned, we built and we delivered.

So we can all take pride in the way our Capital showed itself to the world this year.

As a city that takes massive infrastructure projects in its stride.

As a city that deals with huge numbers of commuters, visitors and residents.

And as a city that successfully staged the greatest show on earth.

The challenge is to keep up that momentum, and make sure we're planning ahead so that London stays where it should be - at the top of the list of world cities.

That will require continued investment in transport.

To relieve congestion as the city grows.

To make new links, connecting people and businesses

And to support regeneration projects that are vital to development.

This government is putting in the resources because we know that giving people and businesses access to a high quality, high performance transport system makes sense for our country's future prosperity.

That's why, in the current Spending Review period, we committed £30 billion to road, rail and local transport projects across the country.

But we also understand that investment is vital for our capital

  * to support a labour productivity rate here in London that's more than 31% above the national average.
  * to maintain the City's position as the world's number one financial centre
  * and to fuel an economy that accounts for around 19% of UK GDP

London is Britain's economic engine.

And, by investing in the transport infrastructure that serves and supports the Capital, we can keep that engine powered, for the benefit of the whole country.

## Aviation

I know that, for many of you, aviation is one of the key transport issues at the moment, especially on this side of London.

So there's a legitimate debate to be had about the future of aviation.

But it's important that debate is informed by the facts rather than by anecdote.

In Heathrow, we've got the busiest international airport anywhere in the world.

And our Capital and our country are among the best connected places on the planet.

Without question we are in the global aviation premier league.

But as my colleague the Secretary of State reminded us in his recent Party Conference Speech in Birmingham, it's not going to last, if we don't act.

Birmingham, Manchester, Glasgow, Edinburgh all have first rate airports too.

But in the south east the runways are filling up and the planes are being left to circle in our skies.

So in the short term we're increasing reliability and reducing delays by trialling operational freedoms at Heathrow

But it's vital that we think long-term about how we remain globally competitive and globally connected.

Of course there are all sorts of ideas - usually as many ideas as there are people in the room.

So we've asked Sir Howard Davies to chair an independent Airports Commission to consider the connectivity needs of the UK, and to make recommendations to government on how those needs can be met.

The Commission will provide an interim report to the government no later than the end of 2013 and then publish a final report by the summer of 2015.

I expect that Sir Howard will soon be setting out further details on the membership of the Commission and its work….including how he intends engaging with interested parties.

So, if you class yourself as an interested party, then watch this space.

## Investment in London's transport infrastructure

I'd like to talk now about some of the other transport projects that are already underway.

Improving the road networks that serve London for example.

Whether it's working with TfL and ensuring that utility companies speed up their road-work, or it's easing congestion on key strategic roads, like the M25, through innovations such as hard shoulder running and managed motorway technology.

Then there's the Tube upgrade programme - work that will deliver a 30% increase in the capacity of the Tube network.

West London is already starting to see the benefits; the entire fleet has been replaced on the Metropolitan Line, with 58 new longer, air-conditioned trains, with the same to follow on the Hammersmith and City Line.

Also in West London, Royal Oak has seen the first two Crossrail Tunnel Boring Machines begin their journey under the city.

When completed, Crossrail will deliver faster journey times and a 10% uplift in capacity.

It will bring an additional 1.5 million people within 45 minutes of London's business centres.

And it will support employment growth of up to 30,000 jobs by 2026 in Central London.

The Crossrail scheme as planned will deliver 8 new underground stations in the central section.

27 upgraded and reconstructed surface stations.

And up to 14,000 jobs during the peak construction period in 2014.

By 2026, we estimate it will carry 200 million passengers each year.

The impact will be felt all the way along its route, not just in central London.

Crossrail is already having an impact on investment decisions, supporting and accelerating new development.

This includes thousands of new homes, and millions of square metres of commercial office space within one kilometre of stations along the route.

Recent research has estimated that residential capital values immediately around stations could increase by 25% in central London and by 20% in the suburbs.

But despite all the planned investment in the tube and Crossrail, demand forecasts show that, without additional investment, crowding will return to unacceptable levels by 2030.

So thinking is needed now about how to address this challenge.

One option championed by many in the business community is Crossrail 2.

Something I know TfL are studying closely…and I look forward to reading their analysis when it's completed.

Then there are TfL's proposals to extend the Northern Line from Kennington to Battersea.

This is an extension that would improve transport links and support the transformation of Nine Elms and Vauxhall, a designated regeneration area on the South Bank.

Up to 25,000 jobs and 16,000 new homes could be created and journey times from Nine Elms or Battersea to the West End or the City would, in some cases, be less than 15 minutes.

## HS2

Rail capacity will also get a major boost from HS2, our national high speed rail network.

HS2 has the potential to transform the entire country's social and economic geography.

But think about the potential positives for London:

  * better connectivity and faster journeys between economy of London and the South East and the economies of the Midlands and the North
  * our major cities brought closer to the Capital and closer to the cities of Europe
  * new opportunities, new markets and new customers for London's businesses

This is a project that makes sense for Britain and London, which is why this government is giving it our full on, flat out backing.

## Future sources of funding

As this audience will know, government grant funding for TfL - currently over £3bn a year - provides an important source of funding.

But in a world of constrained public sector resources we need to encourage other sources of investment too.

So we're working with Treasury colleagues to accelerate major infrastructure investment, looking at new ways to unlock new sources of capital, from international sovereign wealth funds to UK pension funds.

And we also want to enable the Mayor and TfL and London Boroughs to share in the profits of London's growth, giving them an even greater incentive to invest in business-friendly measures, a positive spiral for London.

Reforms to local government finance will see part of TfL's funding come from business rates in the capital, rather than traditional grant from central government.

This Business Rates Retention scheme, due to start in April 2013, will see London and other local authorities retain a share of the growth in business rates.

This is positive news for London.

It's also a real incentive for the GLA, the Mayor and the Boroughs to work with business to grow jobs and to grow prosperity.

## Removing barriers to investment

This government understands that a modern economy needs a modern transport system.

So, for us, the DfT is as much a Department for Growth as it is as a Department for Transport.

But we also recognise that, to get Britain moving you need to do more than invest in infrastructure and regeneration.

You also have to knock down the barriers that get in the way of growth and development.

So, we're also reforming our employment laws.

We're modernising our planning regulations.

And we're cutting corporation tax and getting rid of unnecessary regulations.

In other words, we're freeing up our risk takers and wealth creators by giving business the room to grow and the conditions to invest.

## Conclusion

In conclusion.

I've argued that, in large part, the prosperity of our Capital and our Country depends on the quality of our transport networks.

And I've set out some of the key steps we're taking to modernise those vital networks.

Now, when we came to office, faced with the state of the national finances we could have taken the easy option.

We could have adopted a slash and burn approach to transport investment.

After all, it's what governments have done in the past when the fiscal going got tough.

But just like the people in this audience we understand that there's a heavy price to pay when transport networks are clogged up, stretched to breaking point or past their best.

And, just like, you we know that cost is measured in lower growth and fewer jobs, now and in the future.

So, if there's just one message I'd like you to take away with you today, it is this - we have called time on worn out and run down transport infrastructure.

A government that's driving through programmes and projects, investments and innovations that will transform our transport links and our economic prospects.

A government that is engaging in constructive partnership with the dynamic potential of the private sector, as well as building on the strengths of the public sector.

Coming together to make a real and last difference.

Working together to keep London and Britain moving.

Thank you.

End

This speech represented existing departmental policy but the words may not have been the same as those used by the minister.",draft-text,expanding-and-improving-the-rail-network,making-sure-uk-airports-and-airlines-are-safe-secure-and-competitive-while-reducing-their-impacts-on-the-environment-and-communities,simon-burns,,department-for-transport,22-Oct-2012,2012-10-22
new,http://www.dft.gov.uk/news/speeches/mcloughlin-20121011a,National Transport Awards,"Speech by the Rt Hon Patrick McLoughlin MP, Secretary of State for Transport.","## Opening Remarks

Many thanks for that introduction David (Prof David Begg, Transport Times).

And David, looking around tonight I can see that you're someone who knows how to put on a great show.

But you're also one of most recognised and respected voices in transport.

So, as well as thanking you and your colleagues for the hard work you've put into these impressive awards, I just wanted to express my personal gratitude for your contribution to transport down the years. Long may it continue.

I also want to say a big-thank you for asking me along to an event where I get to share the stage with Jeremy Vine.

Jeremy, it's great to be on the ""bill"" with you tonight. Although, having looked at your CV, I am starting to feel a bit like a serious under-achiever.

There's something important I want to say before anything else.

These awards remind us of the incredible job the people in the transport industry do.

So I just want you to know that this Transport Secretary and this Government recognise, value and appreciate everything you do.

While I have the chance I also wanted to say a very quick word about a subject the transport industry is very familiar with - and that's change.

I realise that changing ministers can be disruptive.

And I know that transport has had its fair share of changes under all governments.

Indeed, there are said to be more former transport secretaries alive than for any other Cabinet job.

So I want to say this:

I am serious about transport.

It's a job I wanted.

It's a job where there is much to do.

## West Coast Mainline

It's also a job where the challenges come thick and fast.

And, as Transport Secretary, I won't be hiding from any of them.

There will be setbacks as well as successes.

This month, when we hit one on the West Coast line, I came straight out and confronted it.

The mistakes made with the West Coast Mainline franchise bid were deeply regrettable and completely unacceptable.

So I've ordered two independent reviews.

The first will report back by the end of this month, the second by the end of the year.

This is a serious issue, and it's getting a serious response.

But let me be clear.

This is not about re-winding to a pre-privatisation past.

This is about learning lessons and moving forward with franchising so that future competitions are robust and deliver best value for passengers and tax payers.

And, while I'm on the subject of delivering value for money, there's another challenge I've faced up to since taking this job - and that's the cost of rail fares.

These are tough and testing times. And I want to help where I can.

So I'm pleased that I've been able to secure funds so that we can cut by 2% the planned increase in key rail fares. And not just for 2013, but for 2014 too.

## Coming home to the DfT

Now, although I may be the new boy at these awards, this isn't my first time at the Department for Transport.

I actually joined the Department in 1989, when Margaret Thatcher was Prime Minister.

I started off as Roads Minister

Then I became the Minister responsible for Aviation and Maritime.

Mind you, seeing as I was afraid of flying, as well as the MP for the most landlocked constituency in the country, ""the Minister for Irony"" might have been a more suitable job title.

Well I'm still proud to represent that same constituency

But I'm pleased to tell you that I'm totally cured of my fear of flying.

Now of course a lot of things have changed in the years since then.

I've certainly got more grey hair.

And I've definitely put on a few pounds.

But one thing remains exactly the same - and that's the crucial importance of our transport links.

And that's why I'm proud to come home to the DfT.

## Introduce myself

I have to say that I'm really excited too.

Excited about the transport milestones the Government has already reached in the first half of this Parliament.

But also excited about our big plans and bold ambitions for the second half of the Parliament and beyond.

So, I could use today's speech to highlight our investment record - a Spending Review that committed £30 billion for transport projects right across the country.

I could explain how we're speeding up journeys and cutting congestion on the roads with innovations like managed motorways.

Or, I could focus on our plans to electrify more than 850 miles of rail track.

I could talk about all the things we're doing to devolve power and give local communities a real say about their transport.

Or I could tell you about our determination to build on Britain's summer of cycling success - encouraging more people to take to two wheels and building safety into our roads. As I said in Birmingham this week, it's something we need to act on.

I could even dedicate the entire speech to HS2.

A high speed rail network that isn't just about taking 20 minutes off the journey to Birmingham, but is actually about shaping and transforming Britain for the next two hundred years.

A network that has cross party support, as well this Government's full commitment.

A network that, like all big infrastructure projects in our history, starts off with controversy, but will end up being used and valued by everyone. Including the people who criticised it.

I could do all of that. But I won't.

Because, rather than talk about transport policy to an audience of transport policy experts, what I'd really like to do is introduce myself properly…

To tell you a little bit about my approach to this job and the principles that will guide me over the coming months and years.

## The Secretary of State for all of transport

I should also tell you that that I'm not in the business of favouring railways over roads or maritime over aviation.

So, as we get the money in and the schemes underway.

As we rebuild, renew and reform.

I will be the Secretary of State for all of transport.

## Reduce the hassle

The next thing you need to know about me is that I speak plainly. But I think big.

You won't catch me using jargon like ""calling points"" instead of stations.

I'm ambitious about transport because I'm ambitious for Britain.

Transport is the artery of any economy.

It gets people to work, children to school and food to the shops.

When transport slows, everything slows.

When transport stops, everything stops.

Everyone depends on transport every day.

So when people ask: ""what's your aim in the job?""

My answer is straightforward - my task is to reduce the hassle of getting around.

## Constructive co-operation, common ground

But I know that's not a one-person job.

So I want to engage and work with the transport industry.

And I could summarise my approach in two words - constructive co-operation.

Coming together and working together on common ground.

The common ground where we can find workable solutions to the big transport challenges out there.  
That's the approach I want to take.

Tonight is a celebration of your achievements and I know you're keen to get on with it.

So it's time I finished up. And as my wife always tells me - nobody will ever complain if a politician's speech is too short.

## The nominees

Before I conclude though, I just wanted to say something about the shortlist for this year's awards.

And, to do that, I'd like to look back to this summer's fantastic festival of sport, the 2012 London Games.

As far as I'm concerned, it wasn't just our Olympians and Paralympians who delivered the goods.

Because, this summer our transport networks and our transport industry were put to the test like never before.

And they were brilliant.

So you should all feel rightly proud.

As indeed should tonight's nominees.

Tonight's short-list ranges from small local initiatives to big national projects.

And from teams who developed innovations in transport technology…to individuals who radically improved customer service.

Every nominee is different.

But, having seen that short-list, I know that you all share something in common - excellence.

## Concluding remarks

Some people wonder all their lives if they make a difference.

Well, that's not a problem for tonight's nominees, or indeed for anyone working in this country's transport industry.

Because in making a difference to transport you are making a difference to Britain.

That's why it's an honour to share this special evening with you.

That's why it's great to be back at the DfT.

And that's why I'm looking forward to working with all of you.

And on that note it just remains for me to thank-you for listening and to wish good luck to everyone who's waiting nervously to hear if they've won an award.

Thank you very much and have a great night.",transcript,managing-improving-and-investing-in-the-road-network,making-sure-uk-airports-and-airlines-are-safe-secure-and-competitive-while-reducing-their-impacts-on-the-environment-and-communities,patrick-mcloughlin,,department-for-transport,11-Oct-2012,2012-10-11
new,http://www.dft.gov.uk/news/statements/baker-20120911a,Fuel Quality Directive Transposition,Written statement by Parliamentary Under Secretary of State for Transport (Norman Baker).,"Today I am publishing our response to the comments received in the [consultation on our proposals to implement Articles 7a to 7e of the EU Fuel Quality Directive (Directive 98/70/EC as amended by Directive 2009/30/EC)](http://www.dft.gov.uk/consultations/dft-2011-04/). The Directive requires suppliers to reduce the lifecycle greenhouse gas intensity of many transport fuels.

The response sets out our decision to introduce new secondary legislation to transpose requirements of the Fuel Quality Directive, including new annual reporting requirements for fossil fuels and biofuels.

The document also details our commitment to amend the Renewable Transport Fuel Obligations Order 2007 (""RTFO Order 2007"") to include fuels used in non-road mobile machinery, a policy already announced to the House on July 16 when the Department published a related consultation response (Official report, 16 July 2012, Column 112WS).

An amendment made in December 2011 to the RTFO Order 2007 means that only biofuels meeting minimum sustainability criteria count towards renewable energy targets. Sustainable biofuels play an important role in our efforts to tackle climate change and reduce greenhouse gas emissions from the transport sector. However, concerns remain about the sustainability of some biofuels, especially around the issue of indirect land use change (""ILUC"") and we are pressing the European Commission and other Member States to produce a robust method to address this issue. Pending that clarity we are taking a cautious approach to implementing the Fuel Quality Directive.

The Fuel Quality Directive introduces the requirement for many transport fuel suppliers to reduce the greenhouse gas intensity of the fuels they supply by 6% in 2020. We will not impose on suppliers a greenhouse gas reduction obligation at this point. Instead, we will place an ongoing legal duty on the Secretary of State to propose any further measures necessary to ensure delivery of the requirements of the Fuel Quality Directive. We will rely on the amended RTFO Order 2007 to deliver the greenhouse gas savings necessary under the Fuel Quality Directive for the period up to 2014. We will also put in place a requirement for fuel suppliers to report on the greenhouse gas intensity of both the biofuel and fossil fuels they supply for use in land-based transport and for the associated uses listed in the Directive.

This approach allows us to transpose the Fuel Quality Directive at the minimum cost to UK business.

I would like to thank all those who took the time to respond to the consultation.",written-statement,reducing-greenhouse-gases-and-other-emissions-from-transport,,norman-baker,,department-for-transport,11-Sep-2012,2012-09-11
new,http://www.dft.gov.uk/news/statements/baker-20120913a,Reform of Bus Subsidy System,Written statement by Parliamentary Under Secretary of State for Transport (Norman Baker).,"In March, the Government published 'Green Light for Better Buses', in which we set out our plans for improving local bus subsidy arrangements and regulations in England outside London. We undertook to consult on these proposals and I can inform the House that the [consultation has been launched today and will last for 8 weeks](http://www.dft.gov.uk/consultations/dft-2012-39). Copies of the consultation document are available in the House library.",written-statement,improving-local-transport,,norman-baker,,department-for-transport,13-Sep-2012,2012-09-13
