http://www.communities.gov.uk/publications/housing/antisocialbehaviourconsult,A new mandatory power of possession for anti-social behaviour: Consultation,department-for-communities-and-local-government,Anti-social tenants: mandatory power of possession for landlords,"This consultation seeks views on the detail and practicalities of a new mandatory power of possession to enable landlords to take swifter action to evict their most anti-social tenants.

The government's intention is that the necessary legislation be introduced alongside legislative changes required following the Home Office's recent consultation on reforming tools and powers to tackle anti-social behaviour.",3-Aug-2011,7-Nov-2011,9781409830559,,,,improving-the-rented-housing-sector,,,,22-May-2012,http://www.communities.gov.uk/documents/housing/pdf/2148929.pdf,Anti-social tenants: mandatory power of possession for landlords: summary of responses and next steps,"On 3 August 2011 the government published a consultation paper on proposals to introduce a new mandatory power of possession to enable landlords to take swifter action to evict their most anti-social tenants. On 15 August, following the rioting and looting across England between 6 August and 10 August, the consultation was broadened to seek views on whether the existing discretionary ground for possession should be extended to include convictions for riot-related offences committed by the tenant or members of their household, wherever they took place within the United Kingdom.

In respect of the proposed new mandatory power, the consultation paper sought views on how this should be designed; the principles that should underpin it; in what circumstances landlords should be able to use the mandatory power; and, how often in practice they might seek possession using the mandatory power rather than on existing discretionary grounds.

We have now considered all the responses received. Sections two and three of this document summarise responses to the consultation. Section four sets out final proposals and next steps in the light of consultation responses.",9781409834946,,,,,,,,,,,,http://www.communities.gov.uk/documents/housing/pdf/1959275.pdf,A new mandatory power of possession for anti-social behaviour: Consultation,http://www.communities.gov.uk/documents/housing/pdf/19666871.pdf,Letter from Rt Hon Grant Shapps MP - Extending social landlords' powers to seek possession for criminality and anti-social behaviour,,,,,,,,,,,,,,,,,,,,,,,,,,,,,,,,,,,,,,,,,,
http://www.communities.gov.uk/publications/localgovernment/localisingcounciltaxconsult,Localising support for council tax in England: Consultation,department-for-communities-and-local-government,Localising support for Council Tax,"Localising support for Council Tax is part of a wider policy of decentralisation, giving councils increased financial autonomy and a greater stake in the economic future of their local area. This supports the government's wider agenda to enable stronger, balanced economic growth across the country and complements the government's proposals for other incentives, such as the New Homes Bonus.",2-Aug-2011,14-Oct-2011,9781409830504,,,,giving-local-authorities-more-control-over-how-they-spend-public-money-in-their-area,,,,16-Dec-2011,http://www.communities.gov.uk/documents/localgovernment/pdf/2053712.pdf,Localising support for Council Tax consultation: government response,"Earlier in 2010, the government consulted on proposals for the localisation of support for Council Tax in England. This followed the announcement at Spending Review 2010 that support for Council Tax would be localised from 2013-14 and expenditure reduced by 10% from the same date.

This document sets out the outcome of that consultation, how the government intends to respond to the issues raised, and its plans for enabling local authorities to introduce localised schemes in England from 2013-14.",9781409832812,,,,,,,,,,,,http://www.communities.gov.uk/documents/localgovernment/pdf/19510253.pdf,Localising support for council tax in England: Consultation,http://www.communities.gov.uk/documents/localgovernment/pdf/2063707.pdf,Local Government Finance Bill: Localising Support for Council Tax - Equality Impact Assessment,http://www.communities.gov.uk/documents/localgovernment/pdf/2158675.pdf,Local Government Finance Bill: Localising support for council tax - Updated impact assessment,http://www.communities.gov.uk/documents/localgovernment/pdf/2053967.pdf,Local Government Finance Bill: Summary impact assessment,,,,,,,,,,,,,,,,,,,,,,,,,,,,,,,,,,,,,,
http://www.communities.gov.uk/publications/communities/pubrestrictivecovenants,The use of restrictive covenants in the pub industry and their impact on local communities: Consultation,department-for-communities-and-local-government,The use of restrictive covenants for pubs,"This consultation aims to establish an evidence base regarding the use of restrictive covenants which prevent pubs from being used as such once they are sold, and the impact that this has on local communities.

The responses to the consultation will be used by the government to help assess whether action needs to be undertaken.",2-Aug-2011,25-Oct-2011,9781409830634,,,,giving-people-more-power-over-what-happens-in-their-neighbourhood,,,,,,,,,,,,,,,,,,,,http://www.communities.gov.uk/documents/communities/pdf/1957901.pdf,The use of restrictive covenants in the pub industry and their impact on local communities: Consultation,,,,,,,,,,,,,,,,,,,,,,,,,,,,,,,,,,,,,,,,,,,,
http://www.communities.gov.uk/archived/publications/planningandbuilding/draftframeworkconsultation,Draft National Planning Policy Framework: Consultation,department-for-communities-and-local-government,Draft National Planning Policy Framework,"The draft National Planning Policy Framework was published for consultation. This is a key part of our reforms to make the planning system less complex and more accessible, and to promote sustainable growth.",25-Jul-2011,17-Oct-2011,9781409830467,,,,making-the-planning-system-work-more-efficiently-and-effectively,,,,3-Jul-2012,http://www.communities.gov.uk/documents/planningandbuilding/pdf/2172233.pdf,National Planning Policy Framework consultation: summary of responses,"The National Planning Policy Framework was published on 27 March 2012. This is a key part of our reforms to make the planning system less complex and more accessible, to protect the environment and to promote sustainable growth.

Consultation on the draft National Planning Policy Framework closed on 17 October 2011. This is the summary of responses to the consultation.",9781409834090,,,,,,,,,,,,http://www.communities.gov.uk/documents/planningandbuilding/pdf/1951747.pdf,Draft National Planning Policy Framework: Consultation,http://www.communities.gov.uk/documents/planningandbuilding/pdf/1972109.pdf,Draft National Planning Policy Framework: Easier to read summary,http://www.communities.gov.uk/rich-media/mp3/1989848.mp3,Draft National Planning Policy Framework: Easier to read summary (Audio version),http://www.communities.gov.uk/documents/planningandbuilding/pdf/2172846.pdf,National Planning Policy Framework: Impact assessment,,,,,,,,,,,,,,,,,,,,,,,,,,,,,,,,,,,,,,
http://www.communities.gov.uk/publications/localgovernment/resourcereviewbusinessrates,Local Government Resource Review: Proposals for Business Rates Retention - Consultation,department-for-communities-and-local-government,Business rates retention,"This consultation seeks views on the government's proposals to change the way local government is funded by introducing retention of business rates.

It also seeks views on options for enabling authorities to carry out tax increment financing within the business rates retention system.",18-Jul-2011,24-Oct-2011,9781409830498,,,,giving-local-authorities-more-control-over-how-they-spend-public-money-in-their-area,,,,19-Dec-2011,http://www.communities.gov.uk/documents/localgovernment/pdf/2053496.pdf,Local government resource review: proposals for business rates retention consultation: summary of responses,"We consulted over the summer on our proposals for business rates retention which would enable councils who succeed in growing their local economy to get a direct boost to their income.

This document sets out the government's response to that consultation and how the business rate retention scheme will operate to create a direct financial incentive for local authorities who grow their economies that is both deliverable and sustainable. It also sets out how we will ensure that all authorities have sufficient resources to deliver local services.",9781409832713,http://www.communities.gov.uk/documents/localgovernment/pdf/20535021.pdf,Local government resource review: proposals for business rates retention consultation: government response,9781409832720,http://www.communities.gov.uk/documents/localgovernment/pdf/2053505.pdf,Local government resource review: proposals for business rates retention consultation: government response plain English guide,9781409832843,,,,,,http://www.communities.gov.uk/documents/localgovernment/pdf/1947200.pdf,Local Government Resource Review: Proposals for Business Rates Retention - Consultation,http://www.communities.gov.uk/documents/localgovernment/pdf/2054063.pdf,Local Government Finance Bill: Business rates retention scheme - Impact assessment,http://www.communities.gov.uk/documents/localgovernment/pdf/2053967.pdf,Local Government Finance Bill: Summary impact assessment,,,,,,,,,,,,,,,,,,,,,,,,,,,,,,,,,,,,,,,,
http://www.communities.gov.uk/publications/planningandbuilding/localregulationsconsultation,Local planning regulations: Consultation,department-for-communities-and-local-government,Local planning regulations,"In response to reforms in the Localism Bill, the government is revising the regulations which govern the process by which local councils prepare their development plans. This consultation seeks views on whether the revised regulations are fit for purpose.",15-Jul-2011,7-Oct-2011,9781409830429,,,,giving-communities-more-power-in-planning-local-development,,,,27-Mar-2012,http://www.communities.gov.uk/documents/planningandbuilding/pdf/2116593.pdf,Local planning regulations consultation: summary of responses,"In response to reforms in the Localism Bill, the government consulted on revised regulations which govern the process by which local councils prepare their development plans. The consultation sought views on whether the revised regulations are fit for purpose. This document provides a summary of the representations made in response to the consultation, and the government's response to the points raised.",9781409834045,,,,,,,,,,,,http://www.communities.gov.uk/documents/planningandbuilding/pdf/localplansconsultation.pdf,Local planning regulations: Consultation,,,,,,,,,,,,,,,,,,,,,,,,,,,,,,,,,,,,,,,,,,,,
http://www.communities.gov.uk/publications/housing/socialhousingregulator,Implementing social housing reform: directions to the Social Housing Regulator - Consultation,department-for-communities-and-local-government,Directions to the social housing regulator,"A consultation on draft directions to the Social Housing Regulator, which will help implement key elements of the Government's package of reforms to social housing. These reforms include giving social landlords greater flexibility over the types of tenancies they may offer, introducing a nationwide social home swap programme, and enhancing tenant involvement and empowerment.

This consultation was updated on 28 July 2011 to include a revised draft tenure direction. Please see the letter from Housing Minister Grant Shapps for details.",7-Jul-2011,29-Sep-2011,9781409830139,,,,improving-the-rented-housing-sector,,,,21-Nov-2011,http://www.communities.gov.uk/documents/housing/pdf/2017529.pdf,Directions to the social housing regulator consultation: summary of responses,"This is the government's response to the consultation on the directions proposed to be given by the Secretary of State for Communities and Local Government to the Social Housing Regulator under section 197 of the Housing and Regeneration Act 2008.

These directions are needed in order to implement important elements of the Government's planned reforms to social housing. The final directions to the Regulator are on tenure, mutual exchange, tenant involvement and empowerment, rents and quality of accommodation. These directions replace those issued to the Regulator previously.

A complete set of detailed responses are also available to download below.

The final direction to the Social Housing Regulator has been published and is also available to download. ",9781409832157,http://www.communities.gov.uk/documents/housing/pdf/2109167.pdf,Directions to the Social Housing Regulator: Detailed responses - Volume 1,,http://www.communities.gov.uk/documents/housing/pdf/2109180.pdf,Directions to the Social Housing Regulator: Detailed responses - Volume 2,,http://www.communities.gov.uk/documents/housing/pdf/2109183.pdf,Directions to the Social Housing Regulator: Detailed responses - Volume 3,http://www.communities.gov.uk/documents/housing/pdf/2109186.pdf,Final direction to the Social Housing Regulator,,http://www.communities.gov.uk/documents/housing/pdf/1956470.pdf,Amendment to proposed direction to the Social Housing Regulator on tenure - Letter from the Rt Hon Grant Shapps MP,http://www.communities.gov.uk/documents/housing/pdf/1936126.pdf,Implementing social housing reform: directions to the Social Housing Regulator - Consultation,http://www.communities.gov.uk/documents/housing/pdf/1936156.pdf,Tenant Cashback scheme - Impact assessment,,,,,,,,,,,,,,,,,,,,,,,,,,,,,,,,,,,,,,,,
http://www.communities.gov.uk/publications/housing/leaseholdvaluationlimits,Leasehold Valuation Limits - Consultation paper,department-for-communities-and-local-government,Leasehold valuation limits,"This consultation paper contains proposals and the associated impact assessment for updating the property value limits which are used to determine whether certain rights are available to residential long leaseholders. These are rights for such leaseholders to remain in their properties as assured tenants when their lease comes to an end, to extend the lease of their leasehold house or to purchase the freehold of a leasehold house (enfranchise) on particular terms.",14-Jun-2011,12-Sep-2011,,,,,helping-people-to-buy-a-home,,,,1-Feb-2012,http://www.communities.gov.uk/documents/housing/pdf/2078663.pdf,Updating leasehold valuation limits consultation: summary of responses,"This is a summary of responses to the updating leasehold value limits consultation published on 14 June 2011.

The consultation contained proposals for updating the value limits that determine the availability of rights for long leaseholders to remain in their properties at the end of their lease term and to extend their leases or buy the freehold (enfranchisement) of their leasehold house on particular terms.",9781409832768,,,,,,,,,,,,http://www.communities.gov.uk/documents/housing/pdf/1922040.pdf,Updating leasehold value limits: Consultation,,,,,,,,,,,,,,,,,,,,,,,,,,,,,,,,,,,,,,,,,,,,
http://www.communities.gov.uk/publications/corporate/statistics/plan201112consultation,Draft Statistics Plan for 2011-12: Consultation,department-for-communities-and-local-government,DCLG draft statistics plan for 2011 to 2012,"The draft statistics plan describes the Department for Communities and Local Government's proposals for collecting and publishing official statistics over the period April 2011 to March 2012.

We are seeking:

  * users' reactions to our proposals and their views on whether our planned deployment of resources will meet their needs
  * suggestions for the development of any new statistics, products or services
  * suggestions for any further reductions in the amount of data we collect and publish (beyond those already submitted in the context of the 'Single Data List')
  * information from users about the particular uses to which they put our statistics",13-Apr-2011,3-Jun-2011,9781409829485,,,,making-local-councils-more-transparent-and-accountable-to-local-people,,,,,,,,,,,,,,,,,,,,http://www.communities.gov.uk/documents/statistics/pdf/1885667.pdf,Draft Statistics Plan for 2011-12: Consultation,,,,,,,,,,,,,,,,,,,,,,,,,,,,,,,,,,,,,,,,,,,,
http://www.communities.gov.uk/publications/localgovernment/bestvalueconsult,Best value: new draft statutory guidance - Consultation,department-for-communities-and-local-government,Local councils: funding community and voluntary groups,"The Department is consulting on new best value guidance, setting out some reasonable expectations of the way local councils should work with voluntary and community groups when facing difficult funding decisions.

We would welcome comments from any organisations and individuals affected by the new guidance and any others with an interest.",13-Apr-2011,14-Jun-2011,9781409829447,,,,making-sure-council-tax-payers-get-good-value-for-money,,,,2-Sep-2011,http://www.communities.gov.uk/documents/localgovernment/pdf/1976929.pdf,New best value statutory guidance consultation: summary of responses and government response,The Department  for Communities and Local Government launched a consultation on the draft statutory guidance on the Best Value Duty. It sets out some reasonable expectations of the way authorities should work with voluntary and community groups and small businesses when facing difficult funding decisions.,9781409830573,,,,,,,,,,,,http://www.communities.gov.uk/documents/localgovernment/pdf/1885419.pdf,Best value: new draft statutory guidance - Consultation,http://www.communities.gov.uk/documents/localgovernment/pdf/1885453.pdf,Best value: new draft statutory guidance and other measures - Equalities impact assessment,,,,,,,,,,,,,,,,,,,,,,,,,,,,,,,,,,,,,,,,,,
http://www.communities.gov.uk/archived/publications/planningandbuilding/travellersitesconsultation,Planning for traveller sites: Consultation,department-for-communities-and-local-government,Planning for traveller sites,"The consultation on the government's draft planning policy for traveller sites ended on 3 August, and a new planning policy statement for traveller sites will be published as soon as possible, following due consideration of the consultation responses.

The government is also consulting on the draft _National Planning Policy Framework_ until 17 October. As part of this consultation, we welcome views on the consistency of the draft Framework with the draft planning policy for traveller sites, and any other comments about the government's plans to incorporate planning policy on traveller sites into the final National Planning Policy Framework. The new planning policy statement for traveller sites will be reviewed in the light of all comments received and incorporated into the final National Planning Policy Framework.

As part of the consultation on the National Planning Policy Framework, the government would welcome responses to the following question:",13-Apr-2011,3-Aug-2011,9781409829478,,,,making-the-planning-system-work-more-efficiently-and-effectively,,,,23-Mar-2012,http://www.communities.gov.uk/documents/planningandbuilding/pdf/2113385.pdf,Planning policy for traveller sites: Summary of consultation responses,The government held a public consultation on its draft new planning policy for traveller sites. The final policy was published on 23 March 2012. This document sets out the summary of responses to the consultation.,9781409834069,,,,,,,,,,,,http://www.communities.gov.uk/documents/planningandbuilding/pdf/1886164.pdf,Planning for traveller sites: Consultation,http://www.communities.gov.uk/documents/planningandbuilding/pdf/1918325.pdf,Planning for traveller sites: Consultation - Short easier to read summary,http://www.communities.gov.uk/rich-media/mp3/19409041.mp3,Planning for traveller sites: Consultation - Planning for traveller sites Summary (Audio version),http://www.communities.gov.uk/rich-media/mp3/1940904.mp3,Planning for traveller sites: Consultation - Contents (Audio version),http://www.communities.gov.uk/rich-media/mp3/19409042.mp3,Planning for traveller sites: Consultation - Section 1 Introduction (Audio version),http://www.communities.gov.uk/rich-media/mp3/19409043.mp3,Planning for traveller sites: Consultation - Section 2 Policy background (Audio version),http://www.communities.gov.uk/rich-media/mp3/19409044.mp3,Planning for traveller sites: Consultation - Section 3 Key matters for consideration (Audio version),http://www.communities.gov.uk/rich-media/mp3/19409045.mp3,Planning for traveller sites: Consultation - Section 4 The consultation options (Audio version),http://www.communities.gov.uk/rich-media/mp3/19409046.mp3,Planning for traveller sites: Consultation - Section 5 The consultation questions (Audio version),http://www.communities.gov.uk/rich-media/mp3/19409047.mp3,Planning for traveller sites: Consultation - Section 6 About this consultation (Audio version),http://www.communities.gov.uk/rich-media/mp3/19409048.mp3,Planning for traveller sites: Consultation - Section 7 The seven consultation criteria and this consultation (Audio version),http://www.communities.gov.uk/rich-media/mp3/19409049.mp3,Planning for traveller sites: Consultation - Annex A Draft Planning Policy Statement (Audio version),http://www.communities.gov.uk/rich-media/mp3/194090410.mp3,Planning for traveller sites: Consultation - Annex B Consultation stage impact assessment (Audio version),http://www.communities.gov.uk/rich-media/mp3/194090411.mp3,Planning for traveller sites: Consultation - Annex C1 Consultation stage equality impact assessment initial screening (Audio version),http://www.communities.gov.uk/rich-media/mp3/194090412.mp3,Planning for traveller sites: Consultation - Annex C2 Consultation stage full equality impact assessment (Audio version),http://www.communities.gov.uk/documents/planningandbuilding/pdf/2116900.pdf,Planning policy for traveller sites: Equality impact assessment,http://www.communities.gov.uk/documents/planningandbuilding/pdf/2116714.pdf,Planning policy for traveller sites: Impact assessment,,,,,,,,,,,,
http://www.communities.gov.uk/archived/publications/planningandbuilding/microgenelectriccars,"Permitted development rights for small scale renewable and low carbon energy technologies, and electric vehicle charging infrastructure: Consultation",department-for-communities-and-local-government,Permitted development rights for small-scale renewable and low-carbon energy technologies and electric vehicle charging infrastructure,"This consultation seeks views on government proposals to introduce permitted development rights for small scale renewable and low carbon technologies in domestic and non-domestic settings. It also seeks views on introducing permitted development rights and deemed advertisement consent in relation to electric vehicle charging infrastructure.

Annex C of the consultation paper sets out a number of questions on which we are seeking views. To help our analysis of responses, we would be grateful if consultees could use the questions to structure their responses.",17-Nov-2009,9-Feb-2010,9781409819974,,,,improving-the-energy-efficiency-of-buildings-and-using-planning-to-protect-the-environment,,,,15-Mar-2012,http://www.communities.gov.uk/documents/planningandbuilding/pdf/2105627.pdf,"Permitted development rights for small scale renewable and low carbon energy technologies, and electric vehicle charging infrastructure consultation: government response","This report sets out the government's response to the consultation _Permitted development rights for small-scale renewable and low-carbon energy technologies, and electric vehicle charging infrastructure_.",9781409838871,http://www.communities.gov.uk/documents/planningandbuilding/pdf/2105438.pdf,"Permitted development rights for small scale renewable and low carbon energy technologies, and electric vehicle charging infrastructure consultation: summary of responses",9781409833826,,,,,,,,,http://www.communities.gov.uk/documents/planningandbuilding/pdf/microgenelectriccars.pdf,"Permitted development rights for small scale renewable and low carbon energy technologies, and electric vehicle charging infrastructure: Consultation",http://www.communities.gov.uk/documents/planningandbuilding/pdf/2106236.pdf,Permitted development rights for installations of microgeneration equipment on non-domestic premises: Impact assessment,,,,,,,,,,,,,,,,,,,,,,,,,,,,,,,,,,,,,,,,,,
