ignore-status,old_url,title,summary,body,type,policy_1,policy_2,minister_1,location,organisation,delivered_date,ignoretextdate
new,http://www.dft.gov.uk/news/speeches/baker-2012108a,Responding to local needs to improve outcomes,Speech by the Parliamentary Under-Secretary of State for Transport.,"Thank you for inviting me to give the keynote address at this year's National Highways and Transport Network Conference. I am also pleased that the Highways Maintenance Efficiency Programme is helping support this annual conference for the second year.

First let me say that I am very sorry I can't be with you in person, but I am glad that I can be virtually with you at least.

I am always interested in what the National Highways and Transport Network Surveys results reveal about what the public actually think about the various aspect of transport in their local areas. I understand that 75 local authorities subscribed to this year's survey and, given the total number of interviews in each area, this represents a significant insight into public perception.

As the minister with particular responsibility for local transport, how we respond and accommodate local needs is something at the very heart of what I am involved in day-to-day.

The coalition government has placed localism at the centre of its plans. I am pleased to say that we have made considerable progress. This has included the Localism Bill passing through Parliament and now becoming the Localism Act.

However, responding to local needs is about far more than an Act of Parliament. So let me say something about how this is working in the Department for Transport. 

Firstly, our future plans for rail will give local areas more say on their rail services, including a mechanism for local transport bodies, working with the industry, to more easily sponsor additional local services.

I have published our proposals for devolving the funding we provide for local major schemes to local transport bodies that comprise local authorities and local business, through local economic partnerships, working together.

Of course our capital funding via both the integrated transport block and the highway maintenance block is already effectively devolved. This is because what local authorities get is based on established formulae, and the recipients have autonomy in how they use the funds, allowing them to better respond to local needs and priorities.

The Local Sustainable Transport Fund has provided a large number of local authorities, often working together, with £600 million for schemes that create growth and cut carbon at the local level. I am particularly pleased with the wide range of proposals we were able to support, and local councils have come up with imaginative and innovative proposals. Yes, there was competition for the available funding pot, but as many of you know we received applications involving every eligible local authority in England.

The government is playing its part in setting out some high level messages supporting sustainable transport and especially cycling, whilst leaving the detail and delivery very much to be determined at the local level.

The nationwide campaign for road safety has for some years now been based around the THINK branding. I am pleased to say that because of the general upsurge in cycling in recent times - not least because of Team GB's success in the Olympics - we have recently announced a new THINKCYCLIST campaign. The key message is that drivers and cyclists actually have more in common than is often realised. The campaign is therefore about both groups of road users being aware of each other.

The coalition government recognises that well maintained national and local highways are important to the economy, to all road users and to local residents. 

Despite the difficult economic situation we inherited we are providing over £3 billion to councils across England for local road maintenance between 2011 and 2015.

Now I know there is significant scope for many local authorities to change their approach, to emulate the best practice to be found in well-performing authorities, to find efficiencies and to achieve more from their spending on local roads.

In these tight fiscal times, we must all - central and local government alike - use resources much more efficiently to get the best value for money for the taxpayer. 

There are over 150 different highway authorities, very often doing things in quite different ways. It is clear that councils can learn from each other and get more for less. 

This is one of the reasons why I launched the Highways Maintenance Efficiency Programme in April 2011 - a £6 million initiative running until 2018 to improve efficiencies and maximise returns on investment in highways maintenance.

One of the Programme's key hallmarks is that it is sector-led. So, working in partnership it is for local highway authorities and the providers of maintenance services, many of which are from the private sector, to determine the programme's scope and shape its content.

It's also an initiative rooted in this government's commitment to localism, devolution and empowerment.

I am pleased that the Programme's work is now well underway and products like the local highway authority collaborative alliance toolkit have recently been launched. It is already being used by several potential groups of local authorities to form their own alliances.

I understand that several further tools covering asset management and standardisation of contracts and specification are due to be launched this autumn, with others in line for user testing.

I was also pleased to see that the final report of the Pothole Review was published in April and that its recommendations got a good reception. The programme has now put in place an implementation plan to ensure its recommendations are delivered.

I would like to pick up on the customer, quality and cost work being done within the National Highways and Transport Network.

In my view the local authorities responsible for highway maintenance can better respond to local needs in their area, if they have a full picture of all three dimensions. These are:

Firstly, customer perceptions - as revealed by for instance the National Highways and Transport Network survey;

Secondly, quality - the technical quality of carriageways and footways as revealed by the detailed surveys undertaken by highway authorities;

And thirdly, cost - as reflected in the resources spent on maintenance.

Whilst this approach is currently being refined by the National Highways and Transport Network for highways maintenance, the concept may prove equally useful for other aspects of transport such as cycling, walking and road safety.

In conclusion, it is clear to me that work the National Highways and Transport Network undertakes, especially making information on local transport available to local people, is very important. The National Highways and Transport Network both elicits the customer's perception, and also makes it available 'warts and all' to everyone. This is in keeping with the coalition government's policy to increase transparency within all levels of government and throughout the public sector. And having the information widely available allows for analysis and continuous improvement in the outputs and outcomes.

So thank you for listening and I trust you all have an interesting and successful day.",transcript,managing-improving-and-investing-in-the-road-network,,norman-baker,National Highways and Transport Network Conference,department-for-transport,8-Oct-2012,2012-10-08
new,http://www.dft.gov.uk/news/speeches/burns-20120926a,ATOL certificate event,"Speech by the Rt Hon Simon Burns MP, Minister of State for Transport.","## Introductory remarks

I'd like to kick things off with a very warm welcome to one and all.

A big thank-you too, for making the time and taking the trouble to come along today.

## Open mind

The American politician Adlai Stevenson once said: ""a politician is a person who approaches every subject with an open mouth.""

Well I'm pleased to report that, when it came to reforming ATOL, this Government has turned that stereotype completely on its head.

And that's because we approached the issue with an open mind.

We studied the problem.

We examined the evidence.

And we not only talked to travel-trade stakeholders, industry experts and consumer groups, we listened to them.

I believe the end result is an ATOL scheme that better protects consumers in the 21st century holiday market.

## Time to change

ATOL has done a fantastic job of looking after the interests of consumers down the years.

But it was born in the 1970s. And, as everyone here knows, the way we book holidays and flights has undergone a radical transformation since then, especially with the rise of the internet.

Arguably, the paradox of the internet age is that booking a holiday has become a lot more convenient and a bit more confusing at the same time.

Clicking a mouse when you make that purchase is easy, but it's also sown seeds of doubt about what's covered and what's not, about who's protected and who isn't.

So it was time to change, time to update and modernise.

## Proof of protection & peace of mind

And we've certainly done that by taking two important steps.

First of all we've ended the confusion about whether so called ""Flight Plus"" holidays are included in the ATOL scheme. They are.

But, secondly, as of the 1st of October, when you buy a ""Flight-Plus"" holiday, a package holiday or even a ""Flight Only"" trip that's covered by ATOL, you will get one of these - a standardised ATOL Certificate confirming that you are fully protected.

So, whether you're on a website, in a travel agents or making a booking over the phone there'll be no more uncertainty and no more wondering.

Instead you'll have proof of protection and peace of mind

## Concluding remarks

People will now be able to say with absolutely certainty - ""I'm covered, I'm safe.""

But these reforms don't just mean better protection.

They actually mean better protection for more travellers - millions more in fact.

Add all that up and I think what you've got is a job well done and a change worth celebrating.

So before I conclude my remarks I'd like to pay tribute to everyone in the travel industry whose advice, input and sheer hard work helped make this all possible.

We really couldn't have done it without them.

Okay, nobody ever came to an event like this and said: ""that was a great day, but if only the Minister had spoken for longer.""

So, with that in mind, I'd like to thank you for listening and hand you over to Dame Deidre Hutton, Chair of the CAA.

END

This speech represented existing departmental policy but the words may not have been the same as those used by the minister.",draft-text,making-sure-uk-airports-and-airlines-are-safe-secure-and-competitive-while-reducing-their-impacts-on-the-environment-and-communities,,simon-burns,,department-for-transport,26-Sep-2012,2012-09-26
new,http://www.dft.gov.uk/news/speeches/burns-20121022a,Airports Operators Association,"Speech by the Rt Hon Simon Burns MP, Minister of State for Transport.","## Opening remarks

Thank you Andrew. Ladies and gentlemen.

And thanks to Ed for inviting me to speak today.

Over the years it has become something of a tradition for transport ministers to speak at the AOA conference….

Not only because it's firmly established as one of the most important events in the aviation calendar….

But also because it attracts such a distinguished and expert audience.

So I'm delighted to be here today - and to have this opportunity to talk about the crucial role that aviation has to play in our economic recovery.

## 20 years of change

Now - both the new Secretary of State for Transport Patrick McLoughlin and I are politicians of a certain vintage.

Together we have clocked up more than 25 years of service as MPs, ministers, and whips in government and Opposition - including for Patrick a three year stint as Minister for Aviation in Margaret Thatcher's last government.

Looking back over that time, it's extraordinary to see how the aviation industry has changed….

The deregulation of air travel in Europe, and the proliferation of hundreds of new routes from UK airports….

The low-cost, no-frills revolution, which helped make flying affordable to millions more Britons…

The global reassessment of airport security after 9/11….

And the impact of the internet on the way we shop for flights and holidays.

But while aviation has changed over the past two decades, our job in government remains precisely the same.

Dealing with debt.

Stimulating growth.

Pulling every possible lever to create jobs, attract investment, and help some people get on.

Patrick and I were part of a government that not only experienced the recession of the early 1990s…. but that also took the tough decisions needed to lead our economy out of recession….

Decisions that built a foundation for growth and prosperity lasting well into the following decade.

And that's exactly what we're in government to do again today.

## Transport and growth

I'm excited to be part of the ministerial team at the DfT, because I'm a firm believer in the transformational potential of transport.

In my book, transport doesn't just support growth. It creates it.

One of the reasons why Britain was so powerful in the 18th and 19th centuries was its relatively easy and affordable access to a massive world market.

It was Britain's mastery of trade routes - over sea and over land - that gave us such a huge competitive advantage.

Thanks to transport, Britain had better, faster and cheaper links to raw materials - and to a global customer base - than its rivals.

Today, it is the same ready access that is driving the growth of economies like China, India, and Brazil.

The lessons for developed countries like Britain are clear.

Simply making the best products is of no use if you can't connect with the right market.

For decades, Britain has failed to invest in its transport infrastructure, and we are paying the price today in lost growth.

It's why we are investing in our roads and railways, to reduce congestion and overcrowding, and link businesses with buyers.

It's why we are investing in a new high speed rail network - so firms in Leeds and Manchester and Liverpool can connect with customers in London and Lille.

And it is why - in a fast changing industry like aviation - we need a clear strategy to boost passenger service, and maintain our excellent air links with the rest of the world.

But as I will explain shortly, any such strategy needs to stand firm over a period of more than a decade - and across several General Elections. That is why it is so important that we take the time we need to get this right and to build a strong consensus of opinion behind the best option.

## What we're doing

There has been real progress under this government.

We are taking forward the Civil Aviation Bill to modernise the regulatory framework for civil aviation in the UK. The Bill enables the CAA to bring a strong consumer focus to its activities, improving transparency and accountability, and ensuring a better service for passengers.

The recommendations of the South East Airports Taskforce are being implemented, including a trial of operational freedoms at Heathrow to improve reliability and reduce delay.

We've announced a number of short-term measures to improve operations and stimulate growth, including £500m towards a western rail link to Heathrow….. a review of the UK's visa regime…. and the recruitment of extra border staff at Heathrow….

And in July we published a draft Aviation Policy Framework (APF) and have put it out for formal public consultation - so that the final Framework can be adopted by the end of March 2013.

The final version of this key document will then be a formal statement of government policy setting the high-level parameters within which any new proposals for airport development may be considered.

## Connectivity and hub capacity

These improvements are timely and necessary.

But they will not on their own solve our long-term connectivity and capacity issues.

We are well served today.

The UK is one of the best connected countries on earth.

London has more flights to more destinations than any other city in Europe.

And we are fortunate to have so many flights to important trading partners - and global financial centres - like New York, Singapore and Hong Kong.

In what is still a dynamic market, new routes and services continue to be added.

From the end of this month, for instance, the UK will be served by daily flights to Guangzhou - a city that has been held up in the past as an example of our national failure to secure routes into the developing Chinese market.

New services to Mexico City were announced only last week.

And of course new destinations are being offered all the time.

But UK aviation is not only about the South East of England.

We are fortunate in this country to have so many excellent airports outside London, which not only help attract inward investment, and provide access to the global market…they also act as major employers in their own right.

Of course the downturn has affected most AOA members, just like it has businesses throughout the economy.

But many airports outside London and the South East continue to perform exceptionally well considering the wider economic picture.…

From Manchester, which saw passenger numbers rise by 6% to 19 million in 2011, to Belfast International, and Aberdeen.

This growth is being supported by significant investment - at airports like Birmingham, Newcastle, and Bristol - to boost capacity and improve the passenger experience.

However; the growth of airports throughout the UK cannot disguise the wider reality that Britain has failed to follow Germany, France and the Netherlands in planning for our long-term connectivity needs.

The danger is that we risk seeing our direct European competitors benefiting more from the fast growing markets of emerging economies.

## Difficult decision

So we are absolutely clear.

Maintaining the UK's status as a leading global aviation hub is fundamental to our long term international competitiveness.

Yet - at the same time - we must also take full account of the social, environmental and other impacts of any expansion in airport capacity.

This is one of the most difficult debates in transport.

Few other issues have the same potential to provoke a divided response.

Successive governments have sought to develop a credible long term aviation policy to meet the international connectivity needs of the UK……

And in each case the policy has failed.

Either trust in the process has broken down….. consensus on the evidence for the policy has drained away…… or it has proved too difficult to sustain a challenging long term policy through a change of government.

Not only can the aviation industry ill afford for this indecision and failure to continue.

The country can't afford it either.

## Commission

So the government has asked Sir Howard Davies to chair an independent Airports Commission.

Sir Howard's remit is to identify and recommend the options for maintaining this country's status as a global hub for aviation - and indeed as Europe's most important aviation hub.

The Commission will also evaluate how any additional capacity requirements should be met in the short, medium and long term.

The Coalition Agreement is clear, and continues to represent the position of this government.

But the Commission must consider all options if it to reach the best conclusions.

That includes a third runway at Heathrow, and schemes in the Thames Gateway proposed by the Mayor of London and by Norman Foster.

The Commission will be fair and open, taking account of the views of passengers, residents, the aviation industry, business, local and devolved government and environmental groups.

An interim report will be prepared for government no later than the end of 2013, and a final report by the summer of 2015.

We will be in a position to tell you more about the membership of the Commission and its terms of reference in the next few weeks.

The Commission's work will not clash in any way with the draft Aviation Policy Framework.

In fact it will complement it.

When we publish the final Policy Framework next year, it will still establish the high level aviation policy of this government.

That means it will set the parameters within which Sir Howard will consider the aviation needs of this country - and the options for delivering those needs in the short, medium and longer terms.

The Framework consultation is therefore an important opportunity to influence government aviation policy.

I want to thank those of you who have engaged with us during the consultation - and encourage those who have not submitted a response to do so in the next few weeks before the end of this process.

## Conclusion

Now of course I can't speculate on what the conclusions of the Commission will be.

But what I can assure you of is the importance of this work - and the determination of this government to find a solution that's best for Britain.

We will seek to involve the Opposition throughout the process.

And I hope all main parties will back Sir Howard's findings - because it's crucial that we make a commitment that transcends party politics.

The Olympics have shown just what we can do if we are willing to make big decisions, work together, and stay the course.

The success of the transport system during the Games was the result of co-ordinated planning by the Coalition and the previous government, Transport for London, the Department for Transport, and many other organisations over many years.

I would like to pay tribute to many of the companies and organisations represented here today who worked so hard during the Olympics to provide such a welcoming and professional service to visitors who flew in from all over the world.

This was a major logistical challenge for the aviation industry.

Many predicted failure.

But you showed a real spirit of collaboration and collective determination to turn it into a triumph.

And it is that same spirit - of working in partnership towards common goals - that we need to foster again…. once conclusions have been drawn from the work of the Commission and the Aviation Policy Framework.

I think we all realise that we are living through some of the toughest economic conditions for generations.

But we are also living through a time of great opportunity.

Either we can repeat history, and fail once again to confront the infrastructure problems which hold our economy back.

Or we can learn the lessons from history, and build a better future for Britain.

That is what we are doing in government. And with your help, that is what we will do.

Thank-you very much indeed.",transcript,making-sure-uk-airports-and-airlines-are-safe-secure-and-competitive-while-reducing-their-impacts-on-the-environment-and-communities,,simon-burns,,department-for-transport,22-Oct-2012,2012-10-22
