old_url,organisation,title,body,price,policy_1,policy_2,policy_3,policy_4,publication_type,ignore date,publication_date,ignore type,ISBN,attachment_0_url,attachment_0_title,attachment_1_url,attachment_1_title,attachment_2_url,attachment_2_title,attachment_3_url,attachment_3_title,attachment_4_url,attachment_4_title,attachment_5_url,attachment_5_title,attachment_6_url,attachment_6_title,attachment_7_url,attachment_7_title,attachment_8_url,attachment_8_title,attachment_9_url,attachment_9_title,attachment_10_url,attachment_10_title,attachment_11_url,attachment_11_title
http://www.communities.gov.uk/publications/corporate/statistics/newbuyjanjun2012,department-for-communities-and-local-government,NewBuy guarantee scheme statistics: January to June 2012,"This first release of official statistics concerning the NewBuy Guarantee scheme was released under the auspices of the UK Statistics Authority's code of practice on 27 September 2012.

Statistics on the NewBuy Guarantee scheme cover quarterly and cumulative data for England up to 30 June 2012.

This release sets out:

  * **Total Completions** (number of properties purchased under the scheme);
  * **Government's Contingent Liability** (the maximum possible cost to government as a result of government's provision of a guarantee corresponding to these completions); and
  * **Government's Total Costs** (the amount spent by government to date in payment of claims made by mortgage lenders against this guarantee).",Free,increasing-the-number-of-available-homes,,,,statistics-national-statistics,27 September 2012,27-Sep-2012,statistics,9781409836582,http://www.communities.gov.uk/documents/statistics/pdf/2224421.pdf,NewBuy Guarantee Scheme Statistics: January to June 2012,http://www.communities.gov.uk/documents/statistics/pdf/2224426.pdf,Pre-release Access list: NewBuy Guarantee scheme,,,,,,,,,,,,,,,,,,,,
http://www.communities.gov.uk/publications/localgovernment/bulletinchanges11-12,department-for-communities-and-local-government,Orders and changes made by the government and councils between 1 October 2011 and 31 March 2012,Orders and changes made by the Government and councils between 1 October 2011 and 31 March 2012.,Free,making-local-councils-more-transparent-and-accountable-to-local-people,,,,transparency-data,27 September 2012,27-Sep-2012,Reports and summaries,978-1-4098-3654-4,http://www.communities.gov.uk/documents/localgovernment/pdf/22248002.pdf,"Bulletin of changes to local authority electoral arrangements, areas and names in England: Orders made between 1 October 2011 and 31 March 2012",,,,,,,,,,,,,,,,,,,,,,
http://www.communities.gov.uk/publications/planningandbuilding/guaranteemonitoringreport,department-for-communities-and-local-government,Planning guarantee monitoring report,"The Planning Guarantee was announced as part of the Government's [Plan for Growth](http://www.hm-treasury.gov.uk/ukecon_growth_index.htm) (external link) on 21 March 2011, alongside a number of other proposals to streamline the planning application process and related consents. Further details of how the Guarantee is intended to operate were set out on [29 July 2011](http://www.communities.gov.uk/news/corporate/1956098).

In principle no application should spend more than 26 weeks with either the planning authority or the Inspectorate if the Guarantee is to be met. The Planning Guarantee Monitoring Report sets out planning authority and Planning Inspectorate performance against a 26 week target.

The Government is considering what further measures may be necessary to support the operation of the Guarantee, including any additional reporting requirements.",Free,making-the-planning-system-work-more-efficiently-and-effectively,,,,guidance,28 September 2012,28-Sep-2012,"Reports and summaries, Legislation and policy",9781409836322,http://www.communities.gov.uk/documents/planningandbuilding/pdf/2226054.pdf,Planning Guarantee Monitoring Report,http://www.communities.gov.uk/documents/planningandbuilding/xls/2226062.xls,Planning Guarantee Monitoring Statistics 2011-12,,,,,,,,,,,,,,,,,,,,
http://www.communities.gov.uk/publications/corporate/quarterlyindicatorssep2012,department-for-communities-and-local-government,DCLG quarterly business plan indicators: September 2012,These tables show the latest figures for the input and impact indicators set out in the DCLG Business Plan 2012-15. The Department has adopted these indicators to help the public assess the effects of policies and reforms on the cost and impact of public services. The individual indicators are unique to the Department. This is the first time that the business plan indicators have been published separately from the Quarterly data Summary management data.,Free,making-local-councils-more-transparent-and-accountable-to-local-people,,,,transparency-data,28 September 2012,28-Sep-2012,"Corporate reports, Reports and summaries",,http://www.communities.gov.uk/documents/corporate/xls/2226154.xls,Quarterly Business Plan Indicators - September 2012,http://www.communities.gov.uk/documents/corporate/xls/2226161.xls,Indicator measurement annex - September 2012,,,,,,,,,,,,,,,,,,,,
http://www.communities.gov.uk/publications/fire/fsb262012,department-for-communities-and-local-government,Fire and rescue bulletin: 26/2012,"Welcome to the Fire and Rescue Service Bulletin for October 2012, covering areas of interest and relevance to the Fire Service.",Free,supporting-fire-and-rescue-authorities-to-reduce-the-number-and-impact-of-fires,,,,guidance,2 October 2012,02-Oct-2012,"Newsletters, Circulars and official letters",9781409836605,http://www.communities.gov.uk/documents/fire/pdf/fsb262012.pdf,Fire and Rescue Bulletin 26/2012,,,,,,,,,,,,,,,,,,,,,,
http://www.communities.gov.uk/publications/communities/righttobidadvicenote,department-for-communities-and-local-government,Community Right to Bid: non-statutory advice note for local authorities,This non-statutory advice note provides a legislative overview of Part 5 Chapter 3 of the Localism Act and the Assets of Community Value Regulations 2012 which introduce the Community Right to Bid.,Free,giving-communities-more-power-in-planning-local-development,,,,guidance,4 October 2012,04-Oct-2012,"Good practice and guidance, Legislation and policy",9781409836629,http://www.communities.gov.uk/documents/communities/pdf/2229703.pdf,Community Right to Bid: Non-statutory advice note for local authorities,,,,,,,,,,,,,,,,,,,,,,
http://www.communities.gov.uk/publications/corporate/spendingdataaug12,department-for-communities-and-local-government,DCLG spending data August 2012,"HM Treasury requires that all central government departments publish details of their spending for transactions over £25,000, and publish monthly data by the last day of each month. This department has lowered its threshold and publishes its transactions over £250.

Available below are the spending report and the Government Procurement Card spending report for August 2012.

Points to note on this report:

  * Over £250 transparency spending data is taken from SAP's general ledger payment transactions.
  * As required by HM Treasury, the data relates to accounts payable payments and credit note transactions for grants and procurement expenditure, recorded at the time the transaction was processed on SAP. The data excludes any subsequent journal transactions and accounts receivable receipts.
  * Travel, subsistence and other employee transactions - these are currently published on a summarised anonomised basis. They are summarised by 'Expense area', then 'Expense type', by day.
  * The terms 'localism' and 'neighbourhoods' in the spreadsheets refer to groups within DCLG. They cover policy areas such as housing, planning and local government.
  * The data is published in CSV and Excel formats in payment date sequence.",Free,making-local-councils-more-transparent-and-accountable-to-local-people,,,,transparency-data,5 October 2012,05-Oct-2012,Corporate reports,,http://www.communities.gov.uk/documents/corporate/xls/2231337.xls,DCLG expenditure over £250 August 2012,http://www.communities.gov.uk/documents/corporate/xls/2231340.csv,DCLG expenditure over £250 August 2012 (.csv format),http://www.communities.gov.uk/documents/corporate/xls/2231343.xls,DCLG GPC expenditure August 2012,http://www.communities.gov.uk/documents/corporate/xls/2231346.csv,DCLG GPC expenditure August 2012 (.csv format),,,,,,,,,,,,,,,,
http://www.communities.gov.uk/publications/corporate/workforcedataaug2012,department-for-communities-and-local-government,Workforce management information: August 2012,"Details of the workforce management data for August 2012.

  * These figures are not official statistics. They are internal workforce management information published in the interests of transparency.
  * These figures have not been reconciled centrally with any National Statistics. Where differences appear between the monthly information and National Statistics, clarifying comments will be provided. The ONS quarterly public sector employment statistics provide an official headline measure for comparing the overall size of employment in central government organisations with other sectors of the economy at the relevant quarterly reference point.
  * Some organisations may not have information available for each month, and at this stage coverage may therefore not reach 100 per cent for those organisations in scope.
  * Given the wide range of organisations covered, caution should be exercised when drawing inferences from the figures and care should be taken when making comparisons between organisations.",Free,,,,,transparency-data,12 October 2012,12-Oct-2012,Corporate reports,,http://www.communities.gov.uk/documents/corporate/xls/2233783.xls,Workforce management information - August 2012,http://www.communities.gov.uk/documents/corporate/xls/2233790.csv,Workforce management information - August 2012 (.csv format),,,,,,,,,,,,,,,,,,,,
http://www.communities.gov.uk/publications/localgovernment/wiltshirecouncil,department-for-communities-and-local-government,Improvement notice issued to Wiltshire Council,Improvement Notice issued to Wiltshire Council by the Department for Education.,Free,making-local-councils-more-transparent-and-accountable-to-local-people,,,,transparency-data,15 October 2012,15-Oct-2012,Reports and summaries,,http://www.communities.gov.uk/documents/localgovernment/pdf/2236320.pdf,Improvement Notice issued to Wiltshire Council,http://www.communities.gov.uk/documents/localgovernment/doc/2236323.doc,Improvement Notice issued to Wiltshire Council,,,,,,,,,,,,,,,,,,,,
http://www.communities.gov.uk/publications/localgovernment/londonboroughsutton,department-for-communities-and-local-government,Improvement notice issued to London Borough of Sutton,Improvement Notice issued to London Borough of Sutton by the Department for Education.,Free,making-local-councils-more-transparent-and-accountable-to-local-people,,,,transparency-data,15 October 2012,15-Oct-2012,Reports and summaries,,http://www.communities.gov.uk/documents/localgovernment/pdf/2236329.pdf,Improvement Notice issued to London Borough of Sutton,http://www.communities.gov.uk/documents/localgovernment/doc/2236326.doc,Improvement Notice issued to London Borough of Sutton,,,,,,,,,,,,,,,,,,,,
http://www.communities.gov.uk/publications/corporate/statistics/lgpsengland201112,department-for-communities-and-local-government,Local Government Pension Scheme Funds for England: 2011 to 2012,"Details of the Local Government Pension Scheme in England in 2011-12 were announced on 17 October 2012.

The latest statistics release includes data from 2007-08 to 2011-12 and updates those statistics previously released on 12 October 2011.

The key points from the latest release are:

  * Local Government Pension Scheme expenditure on benefits in 2011-12 was £7.5xbillion, compared with £6.7 billion in 2010-11, an increase of 12 per cent.
  * Income from employees' contributions to the Local Government Pension Scheme in 2011-12 was £1.8 billion, a decrease on 2010-11 of more than 6 per cent. Income from employers' contributions to the scheme in the same period also decreased, albeit by just 0.4 per cent.
  * In 2011-12, total expenditure accounted for 74 per cent of the Local Government Pension Scheme income, up from 58 per cent in 2007-08.
  * Income from investments rose by 13 per cent on 2010-11 to £3.0 billion.
  * The market value of the funds at end of March 2012 was £148 billion. This represents an increase of 4 per cent on March 2011 and an increase of 52 per cent on March 2009.
  * There were less than 1.6 million employees in the Local Government Pension Scheme at the end of March 2012, a 66 thousand, or 4 per cent, decrease over the figure for March 2011.
  * The number of people leaving the Local Government Pension Scheme in 2011-12 because of redundancy was more than 27,400, an increase of more than 55 per cent over the 2010-11 figure.
  * The number of former employees entitled to deferred benefits rose to 1.4 million in 2011-12, an increase of 7 per cent over 2010-11 and an increase of 35 per cent over 2007-08.",Free,making-local-councils-more-transparent-and-accountable-to-local-people,,,,transparency-data,17 October 2012,17-Oct-2012,statistics,9781409836674,http://www.communities.gov.uk/documents/statistics/pdf/2237242.pdf,Local Government Pension Scheme Funds for England 2011-12,http://www.communities.gov.uk/documents/statistics/doc/2237245.doc,Local Government Pension Scheme Funds England 2011-12,http://www.communities.gov.uk/documents/statistics/pdf/1358111.pdf,Pre-release Access list: Local Government Pension Scheme Funds for England,,,,,,,,,,,,,,,,,,
http://www.communities.gov.uk/publications/localgovernment/localtransitionalgrant,department-for-communities-and-local-government,Localising support for council tax: transitional grant scheme,"The Department for Communities and Local Government is making available an additional £100million for one year to support those local authorities in developing well-designed council tax support schemes and maintain positive incentives to work.

The grant will be payable in March 2013 to those authorities who adopt schemes that must comply with criteria set by Government to ensure that low income households do not face an extensive increase in their council tax liability in 2013-14. This funding will enable councils to explore more sustainable approaches to managing the funding reduction that minimise the impact on vulnerable taxpayers.",Free,making-sure-council-tax-payers-get-good-value-for-money,,,,guidance,18 October 2012,18-Oct-2012,"Legislation and policy, Strategies and action plans",9781409836650,http://www.communities.gov.uk/documents/localgovernment/pdf/2239262.pdf,Localising support for council tax: Transitional grant scheme,http://www.communities.gov.uk/documents/localgovernment/pdf/22392769.pdf,Localising support for council tax: Transitional grant scheme - FAQ,,,,,,,,,,,,,,,,,,,,
http://www.communities.gov.uk/publications/localgovernment/accountabilitysystemlondon,department-for-communities-and-local-government,Accountability system statement for the Greater London Authority,"This document sets out the financial accountability system for the Greater London Authority. It has been signed off by Sir Bob Kerslake as accounting officer for the Department for Communities and Local Government. It sets out the financial relationship between the Greater London Authority and the Department and sets out the checks and balances including via the elected London Assembly and through various statutory controls which forms the system at present. The statement also signposts changes which are expected to be made during the year.

This Statement is a sister document to the System Accountability Statement for Local Government published in March 2012. Owing to the unique governance arrangements in the capital, with a strong executive Mayor and elected Assembly, the funding streams and accountability systems are sufficiently different to warrant a bespoke Accountability System Statement.",Free,making-local-councils-more-transparent-and-accountable-to-local-people,,,,guidance,18 October 2012,18-Oct-2012,Reports and summaries,9781409836698,http://www.communities.gov.uk/documents/localgovernment/pdf/2238554.pdf,Accountability System Statement for the Greater London Authority,,,,,,,,,,,,,,,,,,,,,,
http://www.communities.gov.uk/publications/planningandbuilding/guidancemanagedaggregate,department-for-communities-and-local-government,Guidance on the managed aggregate supply system,This letter provides information on the 2015 business rates revaluation.,Free,making-the-planning-system-work-more-efficiently-and-effectively,,,,guidance,18 October 2012,18-Oct-2012,"Good practice and guidance, Legislation and policy",9781409836711,http://www.communities.gov.uk/documents/planningandbuilding/pdf/2238394.pdf,Guidance on the Managed Aggregate Supply System,,,,,,,,,,,,,,,,,,,,,,
http://www.communities.gov.uk/publications/corporate/qeiidataq32012,department-for-communities-and-local-government,Queen Elizabeth II Conference Centre expenditure over £250: July to September 2012,This guidance will help local authorities understand how the Managed Aggregate Supply System should be run.,Free,,,,,transparency-data,19 October 2012,19-Oct-2012,Reports and summaries,,http://www.communities.gov.uk/documents/corporate/xls/2239129.xls,Queen Elizabeth II Conference Centre July to September 2012 dataset,http://www.communities.gov.uk/documents/corporate/xls/2239131.csv,Queen Elizabeth II Conference Centre July to September 2012 dataset (.csv format),,,,,,,,,,,,,,,,,,,,
http://www.communities.gov.uk/publications/corporate/continuousimprovement,department-for-communities-and-local-government,DCLG continuous improvement strategy,Take a look at the expenditure over £250 for the Queen Elizabeth II Conference Centre for July to September 2012.,Free,making-local-councils-more-transparent-and-accountable-to-local-people,,,,transparency-data,19 October 2012,19-Oct-2012,"Strategies and action plans, Corporate reports",9781409836612,http://www.communities.gov.uk/documents/corporate/pdf/2239360.pdf,DCLG Continuous Improvement Strategy,,,,,,,,,,,,,,,,,,,,,,
