ignore-status,old_url,title,summary,body,type,policy_1,policy_2,minister_1,location,organisation,delivered_date,ignoretextdate
new,http://www.dft.gov.uk/publications/cold-comfort-conference-2012,Cold Comfort Conference keynote address,Transport Minister's video address to the Surveyor Magazine Winter Conference and Exhibition.,"## Transcript

[Cold Comfort Conference keynote address](http://www.youtube.com/watch?v=f2Ryqw-leSU#t=0s)

Good afternoon

Thank you for once again inviting me to give the keynote address on the opening day of the 21st annual Surveyor Winter Conference and Exhibition.

My apologies that I am unable to be in Coventry in person to give this speech. 

Like all of you at this two day Conference, I take the issue of winter preparations very seriously indeed. Whilst I am pleased to say that last winter's weather was not as severe as in previous years, all parts of the country did naturally still experience spells of snow, freezing rain and below average temperatures. 

As we all know, our weather can be unpredictable and I recall hearing of a cricket match in Derbyshire having play stopped in June due to snow. So it is vital that we do not become complacent and as transport operators we all have robust contingency plans in place to deal with any eventuality.

It is essential that we do everything possible to keep our transport infrastructure - both strategic and local roads, rail network, as well as our airports and port facilities - operating as efficiently and safely as possible.

If we don't there is personal inconvenience. But there is also a wider economic impact. The Report that we published in December last year highlighted that the total cost of delayed journeys to both businesses and individuals due to snow was estimated to be around £280m a day in England alone.

That is why it is important that we continue to build on the recommendations arising from the Quarmby Winter Resilience Report and Audit and the Transport Select Committee report following an Inquiry they undertook in 2011, to ensure that we continue to be in a resilient position as we head into this winter.

We at the Department for Transport are determined to stay ahead of the game.

We continue to work closely with the Met Office to make sure that we have the best advice available to prepare for severe winter weather. 

I note that you will be hearing from Dr Adam Scaife from the Met Office tomorrow afternoon in respect of weather forecasting. I was pleased to see that the Met Office have taken steps to improve their service and last year launched improvements to the National Severe Weather Service which allows more targeted forecasting of potential impacts from severe weather.

We continue to maintain a substantial national strategic salt reserve and have a robust distribution process in place, if for any reason this salt of last resort needs to be allocated.

The findings of the recent salt audit undertaken by the Department suggests local highway authorities will enter the winter with a healthy supply. 

Authorities continue to place orders with domestic salt suppliers and are receiving stocks. This demonstrates that the supply chain is also in a much better position than a few years ago.

The Department will, as in previous years, continue to monitor salt stocks that are held by authorities across the country, as well as the Highways Agency, on a monthly basis. 

It is vital that authorities continue to help us with this activity so we can ensure the country continues to have a good level of resilience. Your co-operation in this is very much appreciated.

Finally, my officials are currently updating the Strategic Salt Protocol Note that we published on the Department's website last year. This note sets out the arrangements for the allocation of strategic salt, if and when required, including the price of salt per tonne. I hope that we will be in a position to publish an updated Note in early October. 

Of course salt is just one issue in ensuring we keep disruption on the transport network to a minimum in the event of severe winter weather, and it is worth highlighting briefly what other modes are also doing to ensure that we enter winter well prepared.

The Highways Agency is currently finalising preparations for its winter driving campaign - 'Make time for winter' - which will commence on 29 October 2012. 

This year the messages will place emphasis on drivers taking more responsibility for their own actions based around two key themes, 'Be prepared' and 'Be informed'.

The purpose of the campaign is to alert drivers to the steps they should take, such as ensuring their vehicles are roadworthy, that they have emergency travel kits in their vehicles, that they drive sensibly and take precautions while travelling, and make use of weather-related traffic and travel information (both before and during their journeys) to make informed decisions - about whether to travel at all.

This year the Highways Agency will continue to work with the freight industry and its campaign messages will be shared with partners and stakeholders including the Road Haulage Association, Freight Transport Association and other independent contractors to assist HGV drivers and freight organisations in preparing for driving in winter. 

This year's winter campaign messages will also feature at ports and truckstops including a range of posters translated into several European languages including, Spanish, French, Polish, German and Italian.

Following our experiences over the last three winters the Agency has a good story to tell. They now have a fleet of more than 500 winter vehicles for treating motorways and major 'A' roads around the clock to help keep the strategic network open under all but the most extreme of circumstances. 

However, when sudden spells of very severe weather coincide with periods of heavy traffic, it is not always possible to prevent congestion and delays, as our winter service vehicles need space to treat the roads quickly and effectively. 

Therefore it's vital that road users - HGV and car drivers alike - give the Agency fleet and their contractors the space to do their jobs following bouts of severe weather. 

On the rail network I am also pleased to say that Train Operating Companies and Network Rail have taken steps to learn lessons from the severe weather in previous winters and apply them in preparing for this one. 

Let me give you just a couple of examples - although I also am aware that you will be hearing from Tony Jackson from Network Rail tomorrow.

Network Rail has Key Route Strategies, which set out arrangements for keeping lines and critical junctions open. On the routes which are electrified with a 'third rail', principally those south of the River Thames in South East England, Network Rail has introduced heating of the conductor rail in critical locations, which will keep it clear of snow and ice.

Network Rail has also introduced improved snow and ice clearance trains, including a snow plough and equipment to keep the conductor rail clear of ice and snow. In some locations, extra point heaters have been installed to ensure that points remain operational during freezing weather and maintenance has been carried out on existing point heaters to ensure their reliability. 

Train Operating Companies have also undertaken maintenance work on their train fleets to ensure reliability during winter operation. This has included actions to minimise problems with frozen sliding doors and frozen couplings. Some fleets on the 'third rail' network have been equipped to spray de-icing fluid in order to keep the conductor rail clear of ice and snow. 

Contingency timetables have also been produced which can be introduced in the event of severe winter weather. These have been validated by Network Rail to ensure that they are capable of being operated robustly. Improvements in timetabling software mean that these can be uploaded to industry journey planning systems overnight, which will allow passengers to have an accurate picture of the level of service being operated.

I am also pleased to say that changes have been made to passenger information systems at stations to improve the accuracy and timeliness of information available to passengers when services are disrupted. These improvements worked very well last year. In addition, some Train Operating Companies are now using social media such as Twitter to disseminate information to passengers in real time. 

I am also pleased that following the disruption to air services at UK airports during the winters of 2009 and 2010, the aviation industry has also taken significant steps to improve its resilience to severe winter weather.

The busiest airports, Heathrow and Gatwick, have made significant investments in additional snow and ice clearance capacity. For example, Heathrow has tripled its clearance vehicle fleet and quadrupled staff numbers available for snow clearance.

Both these airports, and indeed others, have revised their operational command and control procedures to improve their response to severe weather, including working in closer co-operation with airlines and other transport providers.

In addition, websites and social media provided updated flight information to ensure that passengers could fly with the minimum amount of disruption. For those passengers who were unfortunate to have a flight cancelled, the airport and airline operators had robust plans in place to inform those passengers in advance so they could make alternative arrangements or arrive at the airport at a later time.

Last but not least, we all know the importance to the UK economy of ensuring that our port operations remain open during the any severe winter weather event. My officials are working closely with port operators to ensure they build on lessons learnt from previous years and have the right winter management plans in place.

I appreciate the significant efforts that have already been made this year across all transport modes to boost our resilience and preparedness for possible severe winter weather and I hope that any disruption that may occur is kept to a minimum due to the plans that are in place to ensure that the transport system recovers as quickly as possible.

However we must not become complacent. We all should remain alert to ensure that we can tackle any severe winter weather that we may encounter this winter season.

Thank you. Enjoy the Conference.",transcript,managing-improving-and-investing-in-the-road-network,making-sure-uk-airports-and-airlines-are-safe-secure-and-competitive-while-reducing-their-impacts-on-the-environment-and-communities,norman-baker,"Surveyor Winter Conference and Exhibition, Coventry",department-for-transport,21-Sep-2012,2012-09-21
new,http://www.dft.gov.uk/publications/electric-vehicle-event-adastral-park-martlesham-heath-suffolk,Electric vehicle event speech,Video speech by the Parliamentary Under-Secretary of State for Transport.,"## Transcript

[Electric vehicle event speech](http://www.youtube.com/watch?v=UAlP0rXy81Q)

I am sorry not to be able to be with you today at Adastral Park - but delighted to be able to join you in your Electric Vehicle event today - by video - and offer my support.

I understand that Adastral Park has always been a pretty cutting edge sort of place with a [stellar] name to reflect its history of experimentation and innovation - in aeronautics first off[1], and then as home for British Telecom's global innovation and development centre.

In a way, it is emblematic of the kind of advance that is being made now with plug in vehicles - with new models coming to market and an ever-widening network of charge points around the country.

The Source East team have made impressive progress, with partners in the public and private sector, to get this bedded in around the East of England.

BT charge points are a welcome addition to the network. So too will be Hutchison Ports' new points at Felixstowe that go into service today - connecting UK's largest container port to the Plugged In vehicle network.

Access to workplace charge points helps to build the case for people moving to the Electric Vehicle option and I fully expect that your lead will encourage other companies to follow.

You have got a number of electric vehicles on site today. I hope everyone who wants to gets the chance to test them out and feel how they drive.

Another welcome development is Source East and green energy UK's announcement of their new partnership - which gives Source East members access to discounted green energy for home charging over night.

For many Electric Vehicle drivers, that is going to be the routine - delivering major savings on running costs and freedom from fuel forecourt queuing.

This is a time of innovation and ground-breaking technology development - much of it happening here in the UK.

It is giving motorists great new driving opportunities - which will as well help put a significant dent in our carbon emissions and create new opportunities for economic growth.

The Coalition Government is four square behind this. We have made a £400 million commitment, among other things to support grants for plug in cars and plug in vans and to provide funding for Plugged In Places like Source East.

I hope you have a very good day and make the most of testing out the new kit.

[1]Royal Flying Corps/RAF test centre from 1917",transcript,managing-improving-and-investing-in-the-road-network,,norman-baker,"Adastral Park, Martlesham Heath, Suffolk",department-for-transport,27-Sep-2012,2012-09-27
new,http://www.dft.gov.uk/publications/investing-in-future-transport-conference-london-city-hall,Investing in Future Transport Conference opening speech,Speech by Parliamentary Under Secretary of State for Transport to delegates attending the Investing In Future Transport Conference.,"## Transcript

[Investing in Future Transport Conference opening speech](http://www.youtube.com/watch?v=lFoiHF2Kk0c)

I am sorry not to be able to be present at your conference today - but delighted to have the opportunity to say a few words to open this afternoon's session - focused as it is on the challenge of transport in an urban environment.

For me, the theme chimes in very closely with the work that I have been pushing forward while I have been in Government.

In a nutshell - developing a transport system that creates growth - and cuts emissions. Especially carbon emissions. 

Clearly how we get around in the future - whether in cities or elsewhere - will have a huge impact on how we achieve these aims.

Around a quarter of UK domestic carbon emissions are from transport - and over 90 per cent of those are from road traffic.M

It's worth pointing out, as did last month's UK Climate Change Committee report, the good progress being made in reducing emissions from new cars.

A 4.2% reduction between 2010 and 2011, and on track to meet the indicator target for 2020 - 95 grammes of CO2 per kilometre. That is good news. But of course we want to go further.

The UK Government has been determined to create the right conditions for the development of the early market for ultra low emission vehicles - ULEVs [youlevs] as they are known. We have made a £400m commitment. 

Last year we put in place the Plug-In Car Grant and extended it to vans this year. This has helped generate a step change in the uptake of ULEVs.

Total claims in the first half of this year are more than we saw in the whole of 2011. 

And with new models coming to the market, I expect to see this trend sustained and growing, in line with our expectations.

Of course it is the case that people are hardly likely to buy a ULEV if they don't see the infrastructure needed to use them already in place. 

So, the Coalition Government has taken a lead on this with the Plugged In Places programme. And I'm delighted that, as we anticipated, the private sector has now seen the commercial opportunity this presents and come in with really significant investment. 

Further evidence, if any more were needed, that creating growth and cutting carbon are 2 sides of the same coin.

The combined number of private and public sector charge-points now stands at around six thousand.

Of course hydrogen is also one of the options to decarbonise transport. 

With industry we have set up the UK H2 Mobility project.

It's looking at the potential for ""hydrogen fuel cell"" electric vehicles - and what investment would be required to commercialise the technology, including refuelling infrastructure, from 2015. 

It is good news that London, where there is already a significant level of hydrogen activity, is pitching for a leading role in this field.

As well as having ULEV responsibilities, my portfolio also covers what's known as ""smarter choices"". Changing the way we travel isn't just about changing the car we drive or how we deliver goods.

It's about thinking differently - even as far as thinking whether on each occasion we need to travel at all, now we are in the age of video-conferencing and other ground-shifting technology.

These Olympics have been like a test bed, stimulating people to try fresh approaches and allowing individuals and organisations to re-engineer how they go about their business. I hope and expect that these changes won't be a one-off.

For many of you here today the focus of interest will be London. 

And London has certainly been rich with innovation on the transport front.

But countrywide, funding made available by the Government, like the £560m Local Sustainable Transport Fund, now increased to £600m, the Green Bus Fund, and funding for the low carbon truck demonstration trial, is helping to spark real innovation. 

Let's remember, it is the short-distance local trip where the biggest opportunity exists for people to make sustainable transport choices.

Around two out of every three trips we make are less than 5 miles in length. Many of them could be easily walked or undertaken by public transport, with cycling an increasingly popular option.

I have been determined to help deliver funding to create an environment where people can feel confident about cycling.

There are some really good projects going on around the country.

Now I am not complacent in the least about any of this. There are huge challenges in transport, not least in terms of air quality where there is still much to do.",transcript,reducing-greenhouse-gases-and-other-emissions-from-transport,,norman-baker,"Investing in Future Transport Conference, London City Hall",department-for-transport,21-Sep-2012,2012-09-21
